pics,summary,tel,site,time,traffic,ticket,opentime,location,insides,id,name55,黎黄陂路位于湖北省武汉市汉口，其全长604米，建于1900年（光绪26年），为黄陂人所建，故名黄陂路，其前身是俄租界时的夷玛街。因两任民国大总统黎元洪是黄陂人，人称黎黄陂，所以此路又于1946年改称黎黄陂路。1997年武汉市江岸区政府将其辟作街头博物馆加以保护。 1861年汉口开埠后，列强纷纷涌入。在黎黄陂路（夷玛街）周边2.46平方公里的区域内，划分了英、法、俄、德、日五国租界，建立了12个外国领事馆、近30家外资金融机构和100多家洋行，汉口呈现了一派带有殖民色彩的畸形繁荣，成为殖民者们乐而忘返的“东方芝加哥”。而位于租界中心的黎黄陂路，则是这段屈辱历史的缩影。 如今黎黄陂路街头博物馆包括十七处古建筑，在街头与街尾都立有碑牌标示。,,,,,,,湖北省武汉江岸区黎黄陂路55号附近,,7389666,黎黄坡路街头博物馆
113,木兰草原——华中唯一的AAAA级蒙古风情景区，位于武汉黄陂王家河镇街聂家岗，荆楚名山——木兰山东面，湖北十大休闲度假区——木兰湖的南面，属“木兰八景”之一。景区距武汉市城区36公里，最近的高速出口12公里，交通十分便捷。景区规划面积4800亩，分为草原风情旅游区和休闲度假区，融草原风情观光、户外拓展、水上游乐、商务会议、休闲度假为一体，是目前华中地区唯一的以草原风情为主题的AAAA级风景区。,,,,1. 外地到木兰草原：从任何一条高速上武汉外环—岱黄高速----黄陂城区（黄陂大道）----滠水桥----火塔公路----彭岗----木兰草原（黄陂转盘后沿途有路牌指示） 2. 武汉城区：汉口竹叶山----岱黄高速----黄陂城区（黄陂大道）----滠水桥----火塔公路----彭岗----木兰草原（黄陂转盘后沿途有路牌指示）,门票80人民币,8:00—17:30,武汉黄陂王家河镇街聂家岗,,5504185,武汉木兰草原
60,,027-81562008,,,,,,武汉市江夏区金口街,,35625,中山舰博物馆
26,,,,,,,,中国湖北省武汉市武昌区,,6952259,武汉长江大桥建成纪念碑
37,生态旅游、旅游休闲、观光览胜,027-87639763,,,,门票36人民币,,武汉市洪山区九峰村,,5427233,武汉九峰森林动物园
51,一条青龙和一条黄龙在这里交汇——南岸嘴在中国地理上是一个非同小可的地方，被誉为“中国第一角”。因为它是中国最大的河流长江和长江最大的支流汉江交汇处形成的冲击地带。有人说南岸嘴是中国的丹田所在，寓意这里是中国精气最集中的地方。,,,1小时,乘30、108、 248、 531、532、 535、 553、 559、561、648、711、803路到滨江大道晴川阁下，向汉口方向步行500米即到。,免费,全天,武汉市汉阳区南岸嘴,,5614901,南岸嘴
55,,,,,,,,武汉市武昌都府堤二十号的中华路小学谭秋校区,,6202,中共五大会址纪念馆
83,青山环抱，溪流环绕，风水极致,027-61521111,,半天,,80.00元,08:00~20:00,湖北省武汉市黄陂区蔡店乡道士冲村,,7047484,锦里沟
25,,027-85795934,,,,,,湖北省武汉市硚口区解放大道1265号,,6630971,汉口中山公园
31,,027-88073189,,,,,,湖北省武汉市武昌区武昌紫阳路151号(紫阳湖公园对面),,35824,紫阳公园
61,,,,,,,,湖北省武汉市汉阳区滨江大道,,3300122,汉阳江滩公园
68,林区内溪流潺潺，林木遮天蔽日,,,,,,,湖北省武汉市黄陂区前川街城北木兰山风景区,,7047500,木兰山风景区
43,,,,,,,,武珞路47,,3319317,首义公园
33,,,,,,,,武汉市洪山区光谷世界城意大利风情街,,9320843,光谷多莫大教堂
47,清凉寨景区位于武汉市黄陂区蔡店街道西北部，是中国木兰八景之一。现为国家AAAA级景区。距武汉市中心城区85公里，距黄陂中心城区（前川）62公里，平均海拔600余米，景区总面积6000余亩，辖区内的刘家山是武汉市海拔最高的自然村。该村地貌独特，相对海拔较高，年平均温差低于武汉市中心城区4-6度；山体高大陡峭，植被丰富，层峦叠嶂，十分壮美，具有发展生态观光旅游和城郊休闲度假旅游的显著优势。,027-61539008,,,1、从武黄高速、汉宜高速、京珠高速上武汉外环至黄陂木兰清凉寨； 2、汉口新华路、竹叶山乘专线巴士可直达黄陂木兰清凉寨； 3、武汉港乘市郊一日游专线车可直达木兰清凉寨； 4、汉口火车站乘公交292到黄陂客运站转乘专线巴士可到达木兰清凉寨； 5、自驾游：从竹叶山上岱黄高速公路到黄陂前川，走黄土一级公路，过姚集镇走姚集公路到蔡店乡，然后前行十公里即到。,50元,07:30—17:30,武汉市黄陂区蔡店街道西北部,,5432655,武汉木兰清凉寨
28,在汉阳古琴台，坐公交车到“古琴台”站下车即到，武汉三镇都有车。如果是在青山区，就坐车到“钟家村”这一站下车。不要门票，规模很大的市政公园，规划的很好，环境不错！,,,,,,,湖北省武汉市汉阳区琴台大道,,7392780,琴台公园
47,"湖北美术学院。坐落于湖北省武汉市，是我国华中地区唯一一所多学科门类与多学历层次的高等美术学府。中国八大美院之一。学校前身是创办于1920年的武昌美术学校，后定名为""私立武昌艺术专科学校""（简称武昌艺专）。武昌艺专是中国现代第一所私立艺术教育学堂，作为我国开办最早的三所艺术专科院校（北平艺专、杭州艺专、武昌艺专）之一和中国近、现代高等美术教育的发源地之一，迄今已有90余年的办学历史。",,,,,,,中国湖北省武汉市武昌区中山路374号,,5686674,湖北美术学院
145,"黄陂大余湾属黄陂区管辖的研子岗镇，依山傍水，宁静如画。占地面积300亩，该村的古建筑群属明末清初的民俗建筑，20余条巷子纵横分隔。现存50多户石砌屋，大部分至今仍保持较完好。这些石屋雕梁画栋，是典型的明清徽派建筑风格。该村先祖曾有过“一门三太守,五代四尚书”的辉煌历史。 大余湾距武汉市区40公里，坐落在乡村的公路边。村头是一望无垠的农田，田边散见丰收后堆积的小山似的稻草垛，还有三三两两的水牛在田间放牧。走进小溪环绕的村口，青石小径蜿蜒前伸，一幢幢古旧的房屋连环而建，一律的青条石墙，黑瓦飞檐，形成院落交错的小巷，石磨、古井、油漆斑驳的木亭散布其间，偶见残缺的木石雕刻、画梁牌匾，依稀可以想见旧时的精美。 　　虽说大余湾现已声名渐起，村民们依旧过着质朴平静的生活，老人闲坐在屋门口聊天，小孩子在巷子里自由玩耍。遇到进村参观的游客，他们会热心地为你指点路线，任凭游人自由地穿行在村中。大余湾村寨后面群山连绵，乃是木兰山余脉，不远处，滠水河似一条银色的飘带，环绕山岗缓缓流淌。山势不高，不一会我们就爬上了山顶，眺望山下，大余湾的全貌一览无遗，大余湾就静卧在这青山绿水间，气定神闲。我们也静静平躺在草地上，闭目休憩，浑然不觉时光流逝。",027-61561777,,,搭车：从汉口竹叶山转盘处乘车到“梳子店”的班车，一日数班，票价8元，到大余湾需时1.5———2小时。也可乘车先到研子，再乘面包车东行5公里左右至大余湾。（票价10元左右）。 自驾：去大余湾与去木兰山是同一条路线。如走南线，从研子岗镇就要东拐了，从木兰山川下游进入，不必翻山坡，但要经天然堤涉过滠水河。如走北线，从长岭镇东拐，有一条南向岔道可翻山入川（可惜还未安装指路标牌），翻山时有几个盘山弯道还是要格外小心。,成人50元,08:00—17:00,黄陂区研子岗镇双泉村,,5426656,黄陂大余湾
18,阅马场位于湖北武汉市武昌城区中部，蛇山南麓，东接蛇山洞延伸出来的武昌路，南至阅马场小学，西到湖北剧院，北临蛇山南麓黄鹤楼下，东西长100米，南北宽300米（另一资料为东西长200米，南北宽400米，可能因计算方式不同）。武珞路以此为起点，横贯广场的中部，并向东伸展，西北与武汉长江大桥的引桥公路相连，西南与彭刘杨路相通，是连通武汉三镇的主干道。,,,,,,,湖北省武汉市武昌区蛇山南麓,,6630983,阅马场
24,武汉大学信息科学学部是原武汉测绘科技大学。2000年原武汉大学、武汉水利电力大学、武汉测绘科技大学、湖北医科大学合并成新的武汉大学后成为武汉大学信息科学学部。信息科学学部现有六院一系，分别为计算机学院、遥感信息工程学院、电子信息学院、国际软件学院、测绘学院、资源与环境科学学院和印刷与包装系。,027-68779405,,,,,,中国湖北省武汉市洪山区珞瑜路,,5689312,武汉大学信息学部
23,,027-88075010,,,,,,湖北省武汉市武昌区梅家山,,35626,起义门
20,,027-87639763,,,,60元,,湖北省武汉市洪山区九峰乡狮子峰特1号,,35703,九峰国家森林公园
20,汤逊湖旅游度假区是由湖北华泰置地实业股份有限公司建造投资额达二亿多人民币，占地面级为十平方公里，坐落于国家级武汉东湖心技术开发区庙山小区，该度假区位于景色秀丽的汤孙湖畔，自然景观令人心旷神怡、流连忘返，首期开发轶平方公里。汤逊湖位于湖北省武汉市江夏区汤逊湖畔，占地面积近32万m2里，是全国首家以图腾文化为主题的度假区。该度假村是按照“天人合一、返朴归真、回归自然”的思想组建的，其主要代表作为68个各具特色的民族大型图腾陶雕组成的图广场，以及由近两千条不同时代风格的图腾龙构成的文化艺术长廊。村内设有垂钓、游泳、射箭、网球、休闲别墅、蒙古包、人造瀑布、九曲桥、龙王庙、白塔、观音岛等项目和景点。同时还经常举办各类大型图腾文化表演、古神秘祭祀、焰火晚会、假面舞会、篝火晚会、民间杂耍等娱乐活动，备受广大游客青睐。,,,,,,,武汉市武昌区江夏大道,,31569,汤逊湖
59,张公山寨位于武汉市洪山区城郊，毗邻武钢白玉山，与东湖风景区隔坝相望。景点景区有张公山寨、橘子洲、桃花岛、吴主寺、开心农场、森林别墅、拓展演习、真人CS战场、严西湖几大 点。园内可乘游船游览，是集湿地生态景观、农业休闲、旅游度假为一体的湿地生态园。 严西湖之胜，独在于水。严西湖湖面2万亩，湖岸线66公里，有99个湖汊，由56个山头环抱，湖水清澈，湖面浩淼。各景点间分布着众多的港汊和鱼塘，形成了严西湖独特的湿地景观。 严西湖之重，重在生态。张公山寨置业有限公司遵循“生态优先、最小干预、注重文化、以人为本和可持续发展”原则，园内除保留原有地形、地貌外，遍植树木、花卉，生态园就是一个天然的绿色氧吧。 严西湖独特的自然景观也孕育了丰富的人文景观，湖边的张公山、吴主寺、十美寺、朱山、鼓架山等，遗存有关孙权、朱元璋、刘伯温、楚庄王、张之洞的人文典故，令人寻奇。,027-86411117;15377664609,,,1．自驾车： A汉口、武昌——青山——和平大道——21号公路——白玉山——张公山寨 B汉阳、武昌——珞瑜路——森林公园——老武汉公路——花山镇——外环（往孝感方向进道道通）——第2个出口北湖站下——张公山寨 C 汉阳、武昌——珞瑜路——森林公园——三环———武汉火车站——青王路——青化路——张公山寨 2.公交车：乘以下215、53、201、525、231路公交车到终点站后搭乘面包车（10元/趟）直达张公山寨大门。 3.景区旺季（3月、4月、5月、9月、10月、11月）会开通张公山寨景区直通车，为游客去游玩提供了更大的方便。,张公山寨门票：张公山寨（含门票、船票、橘子洲）成人票60元/人，特殊人群45元/人；李庄门票：成人票50元/人，特殊人群40元/人；张公山寨、李庄一日游通票成人100元/人，特殊人群80元/人。特殊人群指：儿童身高在1.2-1.4之间；中小学生、大学生学生：凭学生证；60岁以上持老年票。司陪、导游凭证免票；导服费：50元/30人以内、80元/30人以上。,08:00-17:00,白玉山街张公山寨严西湖畔,,5426933,武汉张公山寨
21,"剧院位于月湖之畔，汉江之滨，隔湖南望始建于明万历年间的古琴台，作为月湖文化艺术主题公园的核心组成部份，它将成为武汉最高档次的文化表演场所，也是2007年第八届中国艺术节的主会常琴台大剧院总建筑面积65650平方米，由一个1802座的综合大剧尝一个约400座的多功能厅以及艺术展厅、艺术排练厅、餐厅等多项演出服务设施组成。大剧场采用传统的“品”字型舞台，建筑台口宽18M，高12M，舞台总进深50M，宽72M，拥有一个由两部分组成的面积为92㎡的乐池，可容纳120人的乐队，具备接待大型音乐剧、歌剧、芭蕾、歌舞剧、戏剧、音乐会等各类艺术表演的全栖功能。多功能厅舞台长26M、宽16M、高11M，内设置升降台14块，通过不同组合方式，可以实现不同剧场形式，即：小型剧尝会议厅、“凸”型舞台、“T”型舞台、中心舞台和平面大厅等6种形式。舞台上下方设备联动,组合模式千变万化,给艺术创造巨大空间,能满足国内外各类歌剧、音乐剧、戏剧、戏曲、音乐会使用要求。大剧院2004年5月开工,2007年8月竣工,由武汉市政府投资15.7亿，占地面积24543平方米,总建筑面积65650平方米,地下4层,地上6层,建筑高度40米。其中大剧场有1802个座位,跻身国内特大型剧常大剧院建筑涉及20多个专业,建筑领域公认最难。琴台大剧院,是目前国内大型剧院中,唯一由中国人原创设计——广东珠江设计院在大剧院方案国际招标中胜出。建筑师做大剧院,是一辈子荣幸。从未做过剧院的武汉地产集团,攻克大量技术和施工难关,在琴台大剧院项目上,创下了多项国内纪录,建设质量、速度和成本控制,全国领先。 外观的琴键飞奔,水袖飞舞神韵,青铜幕板的历史厚重感,还有大剧场的红色主调,琴台大剧院让人体味浓郁楚文化。当初,一些专家担忧,大色块用红会让人发疯。不久前,国家大剧院设计师的首席色彩顾问来汉,认可大剧场色彩,更有专家评价:荡气回肠。近来,视察琴台大剧院的领导、院士、专家不少,他们有个共识:媲美国家大剧院、上海大剧院、广州大剧院,填补中部地区高品质文化设施空白。现代化的大剧院是一个国际性城市必备的基础设施。这种剧院要具备三个特性:剧场功能的国际性、剧场设计的民族性、观演定位的便民性",027-81880089,http://www.whqtdjy.com/,,乘658路到琴台大剧院下车即达。或者坐车到鹦鹉大道古琴台站（参考古琴台交通）下车步行700米即到,根据不同演出决定,根据演出时间确定,武汉市汉阳区知音大道6号,,5434209,琴台大剧院
26,中山大道（武汉） 是一条从西南部的硚口路到东北部的黄浦路，贯穿整个汉口中心区的商业街，总长8445米。中间与武胜路、三民路、民生路、江汉路、南京路、黄石路、黄兴路、车站路、蔡锷路、胜利街、一元路、三阳路等共48条能通行机动车辆的街道相交，南与沿河大道和沿江大道、北与解放大道和建设大道平行。,,,,,,,湖北省武汉市硚口区中山大道,,7392614,中山大道
19,,,,,,,,湖北省武汉市江岸区洞庭街,,6630970,长江武汉关
38,,,,,,20元,,中国湖北省武汉市武昌区东湖路,,5682581,东湖牡丹园
18,中南财经政法大学是中华人民共和国教育部直属的一所以经济学、法学、管理学为主干，兼有哲学、文学、史学、理学、工学、艺术学等九大学科门类的全国重点大学，是国家“211工程”和“985工程优势学科创新平台项目重点建设高校。 学校前身是1948年建立的以邓小平为第一书记的中共中央中原局创建，并由陈毅担任筹委会主任的中原大学，1953年院系调整成立了中南财经学院、中南政法学院。1979年湖北财经学院划归财政部领导，1984年12月更名中南财经大学。2000年由原隶属于财政部的中南财经大学和原隶属于司法部的中南政法学院合并组建新的中南财经政法大学，现为中国最知名的财经、政法类高校，在同类院校中拥有最多的博士点。,,,,,,,中国湖北省武汉市江夏区民族大道,,5693824,中南财经政法大学
53,,,,,,,,湖北省武汉市汉阳区龟山北路1号,,9229937,汉阳造广告创意园
17,,,,,,,,湖北省武汉武昌区武汉大学-图书馆,,5688520,武汉大学-图书馆
33,龟山电视塔全称湖北龟山广播电视塔，是我国自行设计、施工的结合旅游的第一座钢筋混凝土广播电视发射塔。该塔于1981年12月16日破土动工，1986年6月竣工投入使用。塔高221.2米，海拔标高311.4米，相对高度280米，就高度而言，建成时居全国之首[1]。龟山电视塔是中国第一座电视塔，坐落于武汉市汉阳龟山之巅、长江和汉江的交汇处，是武汉著名的旅游景点及城市地标，与黄鹤楼遥相呼应，脚下是晴川阁和“万里长江第一桥”——武汉长江大桥，身后是“三楚胜境”之一的——古琴台。此塔是我国的设计人员在没有可借鉴和参考经验的情况下，自己设计的国内第一台电视塔，是一个集发射传输、观光旅游等多功能于一体的完全由我国自行设计和施工的电视塔，有“亚洲桅杆”之称。1986年12月正式对外开放旅游，由前国家主席李先念亲笔题写塔名。,027-84713530;027-59511208,,,10路  10路通宵线  401路  402路  411路  584路  61路  电车1路 长江大桥汉阳桥头下,120元,9:30-----20:50,中国湖北省武汉市汉阳区龟山北路,,5422579,龟山电视塔
23,,,,,,,,中国湖北省武汉市武昌区解放路255号,,5687909,武汉音乐学院
36,,,,,,,,青山区武昌和平大道1546号,,3322209,青山公园
45,大小瀑布起伏跌坨，溪泉交汇，潭溪相接,027-61598318,,,,50.00元,07:00~17:00,湖北省武汉市黄陂区姚家集镇,,7047493,木兰古门
24,,027-88875306,,,,,,武昌区武昌都府堤20号,,31643,武汉市革命博物馆
11,"电视塔座落在武汉风光秀丽的龟山之颠，矗立于长江与汉水的汇合之处，占据绝佳的地理环境，也是武汉市最高的建筑物。它建在１０４m-１３５m间的塔楼设有旋转餐厅,音乐茶座和眺望平台，供旅游活动面积７４０平方米，能同时接待３００人游览。在这里俯视武汉三镇，如登白云，临空鸟瞰，令人流连忘返。",027-84713691,,,,,,武汉市汉阳区古琴台路旁(龟山上),,6244,武汉电视塔
22,龙泉山位于武汉市江夏区龙泉乡。其山东南北三面环水，东面是以盛产武昌鱼名噪海内的梁子湖，南北则有两条山脉自西向东连绵9公里，与处于盆地中的景区形成二龙戏珠之势，形成风景区内7.6平方公里的幽谷风光带。《江夏县志》载：“龙泉山古称灵泉山，因灵泉寺山中有色碧味甘的清泉潭而得名。”龙泉山顺龙盘结，群峰高耸，其山三面临牛山湖与三汊港，在无边碧浪之间，逶迤崛起云山、大龙山、二龙山、龙嶂峰、玉屏峰、天马峰、马鞍峰等，自古这里被视为山环水绕、湖山钟秀、林泉幽穆的“福地仙壤”。龙泉山人文历史可追溯到西汉时期。当时这一地区为舞阳侯樊哙孙樊建的封地，名为江夏，所以其山称为江夏山。唐朝初年改称夹山，取两山夹道而行之义。唐朝天宝末年，宰相李蹊开基造屋，凿地得泉，形成东西两井，东井冒气则晴，西井无气则雨，占验灵准，因此又称灵泉山。汉高祖刘邦以武昌为樊哙封地，樊哙死后，就葬于天马峰下。从汉代起，就有许多隐逸之士迁到灵泉山来隐居，遂成灵泉古市，“形胜甲于一邑”。清同治《江夏县志》有载：“灵泉古市始于汉，迄唐宋而兴盛。”在环山7平方公里的幽谷盆地上，或倚山为亭阁，或随水为轩榭，建有灵泉寺、听松阁、远眺亭、大观桥、春露亭、秋爽亭、晴雨井、百卉园、龙龟戏鱼池、蓼莪堂、含山楼、万卷书楼、拜寿台等蔚然十二大景观。这些金碧辉煌的楼台亭阁，都是樊、李、杜、张、沈、曾、董、邹八大家官府隐逸之士在此修建的，如“万卷书楼”是唐代宰相李奚修建的；“含山楼”是宋代诗人张芸臾修建的；“万寿台”是元代宰相沈如筠修建的。 此外历史上有名的晋代荆州刺史陶侃也葬于此。,027-81620543,,,,80.00元,07:30~17:30,武汉市江夏区浏芳街,,35627,龙泉山
19,,027-88850322,,,,,,武汉市武昌区都府堤41号,,31642,毛泽东同志旧居
19,,,,,,,,中国湖北省武汉市武昌区昙华林188号,,5686670,湖北中医药大学
18,在国立武汉大学时期，武汉大学的工科集中在国立武汉大学工学院，1952年—1953年间中华人民共和国政府对大学进行院系调整，武汉大学的工科集体被调出，大部分专业与湖南大学、广西大学等大学的工科专业一起组建了华中工学院，水利水电专业则在1954年组建了武汉水利学院。 1978年的改革开放之后，武汉大学开始逐渐重建工科，2000年，武汉大学与武汉水利电力大学、武汉测绘科技大学、湖北医科大学合并，武汉大学在改革开放之后重建的电气、土木、建筑、机械等专业与上述三校的相应专业合并在一起组建了武汉大学工学部。,027-87325031,,,,,,中国湖北省武汉市武昌区茶港路,,5688439,武汉大学工学部
14,市内可搭乘68、30路到滨江公园一站下，或608、801路等公交到一元路站下向江边方向走200米即到,,,,,,,在武汉市汉口江岸区滨江公园江堤上,,6156,防洪纪念碑
16,,,,,,,,中国湖北省武汉市汉阳区莲花湖路,,5685252,汉阳江滩
22,宋庆龄汉口旧居在汉口沿江大道的黎黄陂路口，有一座高三层的小楼。始建于1896年，最先是一家专门为俄茶商交易而开设的华俄道胜银行。它有着杏黄色的外表和纪念碑似的塔楼，是座典型的俄罗斯风格建筑。这是宋庆龄1927年在武汉的居所。,027-82296638,,,,,,武汉市江岸区沿江大道162号,,8598127,宋庆龄汉口旧居纪念馆
18,木兰湖旅游度假区位于武汉市黄陂区塔耳街道境内，与荆楚名岳木兰山毗邻，距武汉市区 60公里，有高速公路相通，这里水丰鸟美，人杰地灵，山清水秀，是观光旅游、休闲度假的湖北省省级旅游度假区，被人们誉为荆楚明珠、武汉市的后花园。木兰八景之一。因传说木兰将军幼时在此饮马而得名。湖区面积40平方公里，其中水面20平方公里。湖岸线长57公里，有132个湖汊，23个岛屿，13个泉眼。湖水清澈，风景纯美。湖区东岸的林区，长年栖息着各种鸟类10余万只，其中30%为国家二级保护动物。春秋之季，鹭鸟在此交替云集，蔚蔚壮观。风景区已具备食、住、游等配套服务功能，是游客垂钓、游泳、观鸟、避暑、度假的理想胜地。川内明末清初兴建的古民居民俗村——大余湾，已被批准为中国历史文化名村（湖北今仅2家）、,027-59507850,,,,,,湖北省武汉市黄陂区木兰乡小泉山村,,6630984,木兰湖旅游度假区
18,大智门火车站位于湖北省武汉市江岸区京汉街，又名京汉火车站。于1903年建成启用，新中国成立后改名为“汉口火车站”。京广铁路建成后设立新汉口站，后来仿造大智门站的建筑风格改造成今天的汉口火车站，原站址不再沿用。,,,,,,,中国湖北省武汉市江岸区京汉大道1232,,3314513,大智门火车站
21,武汉月湖公园位于武汉市汉阳区月湖畔。因古代却月城而得名，明成化年间，汉水改道，其主流经龟山北部汇入长江后留下月湖。古代时候，月湖“长约八里许，宽以一里计”，水面不下200万平方米，占地很广。   月湖公园由月湖周边五大景观组成：北岸为文化艺术中心区；南岸邻近古琴台的，为可容纳8000-10000人的露天舞台广场；东侧是小月湖半岛；西南边与梅子山相近。月湖景观的设计主旨，是建造一个展示月湖地区文化历史底蕴、集休闲娱乐为一体、自然风景迷人的主题公园。,,,,,,,湖北省武汉市汉阳区,,3298692,月湖公园
