uid,poi_href,poi_id,name,star,content,datetime,description,pics,tel,site,time,traffic,ticket,opentime,location,insides
17761196,/poi/5803.html,5803,武汉长江大桥,4,公交车，出租车什么的在上面都不会停下来的，一千多米，走过去感觉很爽，在桥上看江面，很辽阔，只是不像海水一样蔚蓝，黄黄的，船很多，那些距离很远的船，看上去当真有古诗中的意境。,2014-04-04 14:05:53,武汉长江大桥古香古色，一年四季，春夏秋冬景色各有千秋，春天凉爽，江风宜人；夏季气候炎热，傍晚伫立桥头凝望海天交接，心情疏爽；秋季硕果时节，看无限夕阳；冬季，要是有偶尔的小雪，站在桥头，感觉世界分外妖娆。 武汉长江大桥是新中国成立之后在长江上修建的第一座大桥，其正桥八墩九孔，每孔跨度达到128m。正桥钢梁由平弦菱形连续梁组成，钢梁设计三联，每联三孔。50年来，历经风雨沧桑的武汉长江大桥，巍然立在大江之上，肩负着每分钟60多辆汽车、每6分钟一列火车通过的荷载，经受了无数次洪水、大风的洗礼，更承受了76次碰撞事故的考验。专家最近检测得出的结论是：大桥的桥墩、钢梁等主体结构可使用100年以上。 自1955年建成以来，就经历过2001年一次比较大型的翻修，在武汉的众多桥梁之中，它是最可靠，维修最少的桥梁。,2480,,,1小时,公交  乘坐11、 18、 25、 43、 514、 539、 542、 554、 566、 572、 573、 578、 607、 717、 804、 916路公交车至【临江大道平湖门】站下车即到。   自驾  从武汉站自驾车前往，全程约19公里。   步行  从黄鹤楼沿黄鹤楼南路步行至大桥，全程约800米。,免费参观 大桥桥头堡内有电梯，2元/人/次,全天,武汉市武昌区临江大道与滨江大道之间,
17761196,/poi/5426285.html,5426285,黄鹤楼Yellow Crane Tower,4,没有走进黄鹤楼里，同行的人说只是名气很大，并没有想象中的那么好，因此也只是在楼的四周走了走，有点儿遗憾,2014-04-04 14:10:22,黄鹤楼位于武昌江畔，紧邻长江大桥，有“天下江山第一楼”的美誉，是地理上武汉的中心。因为建于蛇山之上，再加上5层的楼高，以及周边无高层建筑，所以这里的视野非常开阔。除了黄鹤楼之外，景区内还有大量的石碑、石刻，都是历代名人的真迹。这里绿化非常高，不行在山间非常惬意。每天在落梅轩还有楚地特色的编钟表演，时间分别为10:00，11:40，14:20，16:00，表演免费。,4314,027-88871394,,2小时,电车1路、电车4路，公交10、61、64、108、401、402、411、413、584等路到黄鹤楼站下。或者乘车在阅马场下车（参见首义广场交通）,A.免票政策：儿童在1.2m以下免票，70周岁以上的老人（凭身份证或老年证）免票，现役军人（凭现役军人有效证件）免票、残疾人（凭残疾人证）免票 B.优惠政策：身高1.2-1.4m购儿童票40元，60-69岁的老人（凭身份证或老年证）预订老年票40元，（本科及以下）持有效学生证购票40元,07:30—18:30(4月1日至10月31日)；07:30—17:30(11月1日至3月31日,湖北省武汉市武昌蛇山,
17761196,/poi/5812.html,5812,武汉大学Wuhan University,4,我去的时候樱花都已经谢了，没有看到美丽的樱花，还是有遗憾啊！不过作为一所出名的大学，在学校里漫步看风景，也不失为一种选择,2014-04-04 14:10:42,武汉大学前身为清末湖广总督张之洞创立的自强学堂，1928年，更名为“国立武汉大学”。 武汉大学濒临东湖，环抱珞珈山，校园内绿树成荫，中西合璧的宫殿式建筑群古朴典雅，巍峨壮观，一批建筑如宋卿体育馆、樱园老斋舍、图书馆、半山庐等，被列为全国文物重点保护单位，住宿区还有桂园、枫园、樱园、梅园等四大名园。网评武汉大学为中国十大最美高校之一。 古朴的建筑点缀于茂密的树林之间，四季花开不败，走在校园里，花香鸟语。拿一本书，找一个安静的地方，重温青春时光。,5175,027-68755114,http://www.whu.edu.cn,2-3小时,在武汉到武大的公交车很多，乘317、413、515、519、552、564、572、587、591、608、724路在八一路珞珈山下车即可到达。,武汉大学在每年樱花季时期会向外来游客收取20元参观票，其余时间免费。,全天开放,武汉市武昌区珞珈山路16号,武汉大学樱花节
17761196,/poi/5434154.html,5434154,归元寺,5,说实话，这才是去武汉的重点，朋友说许愿很灵验，只是后来许的愿望实现以后一直没时间还愿，因此我背负着帮朋友还愿的重任来到了这里，但是绝对不虚此行，香火很旺，尤其双面观音，值得一看，寺庙本身就是一处景点了，怀着一颗虔诚的心，一切归元。,2014-04-04 14:13:59,位于汉阳归元寺座落在武汉市汉阳区翠微路西侧。清顺治十五年(1658年)，由浙江僧人白光、主峰来此创建。取名“归元”， 出自佛经《楞严经》归元无二路，方便有多门”。归元即归真，就是超出生灭之界，还归于真寂本源的意思。在佛教中，归元寺属于曹洞宗(该宗系禅宗五家七宗之一)，故又称归元禅寺。它与宝通寺、溪莲寺、正觉寺合称为武汉的四大丛林。,795,027-84844756,http://www.guiyuanchansi.com.cn/,1-2小时,到归元寺门口的只有一辆车401。另外可以选择乘坐45、532、559、727、728等车在鹦鹉大道西大街下车，步行600m抵达归元寺,10元 在黄金周期间，票价有可能会上浮,8:30-17:00，每年春节期间会延长开放时间,武汉市汉阳区钟家村翠微路6号,
17761196,/poi/5774.html,5774,东湖East Lake,4,从武大走出来后面就是东湖了，湖还挺大的，感觉视野比较开阔，和朋友一起坐了快艇，风很大，感觉很刺激，只不过行程很短，看上去很大的湖面，估计走了三分之二就折回去了，中间好像还有一个什么景点，但是时间很赶，所以没有过去看。,2014-04-04 14:15:49,汉东湖风景区位于武汉市城区，景区面积73平方公里，是中国最大的城中湖。主要游览景区有磨山景区、听涛景区、落雁景区、吹笛景区（马鞍山森林公园）、东湖樱园、东湖鸟语林等。在这里可以与自然亲密地接触，可以呼吸到新鲜的空气，每天早晚都有自行车爱好者在这里骑车环湖。,2030,027-86773706,,3-4小时,公交  1、乘坐22路公交车可直达东湖风景区。  2、乘坐14、108、402、534、537、578、605、777、810路公交车可达东湖听涛景区。  3、乘坐401、402、413、515、643路公交车可达东湖磨山景区。   出租车  武汉有两种出租车，一种是富康和爱丽舍车型，起步价6元/2公里，8元/3公里，之后1.4元/km；另一种是新款东风雪铁龙凯旋车型，起步价8元/2公里，之后1.6元/km。另加收2元燃油附加费。,听涛景区免费，磨山风景区60元，落雁景区13元，马鞍山森林公园旺季20元，淡季10元（每年3月11日至6月10日、9月11日至12月10日为旺季）； 磨山索道（单/双）：15/25元,东湖风景区内各景点开放时间略有不同。   听涛景区：8:00-17:00；磨山景区：7:30-17:00；落雁景区：8:30-17:00  湖北省博物馆：9:00-17:00（15:30停止入馆，每周一闭馆）  马鞍山森林公园：8:00-17:00（冬季）、8:00-17:30（春、夏、秋季）,湖北省武汉市武昌区沿湖大道附近,
17761196,/poi/35816.html,35816,轮渡,4,第一天去武汉就体验了一下轮渡，很便宜，2元钱，只是那天风很大，还下着雨，我穿的少，冻坏了，不过感觉还是很爽的，夏天去应该会感觉舒服吧，嘿嘿，还是值得一试的,2014-04-04 14:18:17,,,,,,,,,,
17761196,/poi/6206.html,6206,武汉理工大学,3,因为朋友在这里上学，所以直接来了之后入住她们的学生宿舍了，毕业季，人不多，她们宿舍就我俩，感觉宿舍条件还不错，至于学校，没仔细转，主要是她觉得没什么好看的，在学校食堂吃了几次饭，住了几晚上就走了。,2014-04-04 14:22:47,,,,,,,,,,
17761196,/poi/6418433.html,6418433,南戴河国际娱乐中心,4,比起北京的欢乐谷来说要小很多，但是也值得一试，有不少的娱乐项目，也有一些不刺激的，海盗船旋转木马之类的，刺激一些的有过山车等，名字已经记不清楚了，每个项目排队的人都不是很少，一天的时间基本上够用。还是值得一去的,2014-04-11 15:07:10,南戴河国际娱乐中心包含金龙山、欢乐大世界、碧海金沙、中华荷园、槐花湖五大区域，有滑草场、滑沙场、高山滑艇、滑圈、悬挂式过山车、木星、极速风车、空中飞人等40多种娱乐项目。还有海滨浴场、鸟艺表演、水中泛舟、豪华游艇、假山瀑布、广场喷泉等众多景观。若是购买的联票记得一定要保存好，游玩的项目都需要查票的。,323,0335-4082433,http://www.ndh.com.cn/,1天,公交：乘603路公交车到南戴河国际娱乐中心 自驾： 1.京哈（原京沈）高速“南北戴河”出口下，沿路标指示西行14公里即到 2.沿海高速“抚宁”（或“南戴河”）出口下，5公里即到,门票120元（网上预订110元），70岁以上老人、残疾人（1级-4级）、1.2米以下儿童可免费入园参观,8:00-17:00,南戴河旅游度假区三小区省级森林公园内,
17761196,/poi/5822537.html,5822537,集发生态农业示范观光园,4,里面好多植物，世界各地的吧，奇形怪状的，还有特别长的丝瓜，特别大的南瓜什么的，还有热带亚热带的各种植物花草，每一种都有小牌牌介绍，里面也很大，感觉很不错，挺值得一去的，开眼界,2014-04-11 15:08:18,是一个以生态农业为主题的参观地，园区被分为综合活动区、民俗展示区、吃住休闲区、观赏采摘区、娱乐项目区、动物表演区。观赏采摘区又分为四季花园、四季菜园、四季果园、四季瓜园、热带植物园、丝瓜长廊六大块，里面长满了各类奇异的植物、瓜果；娱乐项目区则是蹦极、高空滑索、攀岩、滑雪、滑草等普通娱乐项目。  这里不光可以看到上千种植物何40多种动物，还可以攀岩、蹦极、空中飞人；在戴河第一漂乘坐竹排欣赏两岸风光；在獐乐园荡秋千、踩滚桶；在水上乐园一展身手。同时还可在环境独特的农家饭庄品原汁原味的农家饭菜。,286,0335-4019002,,建议3-4小时,乘5路到太平庄下车，步行1km才能到,旺季（4月1日-10月31日）40元，淡季（11月1日-次年3月31日）20元，1.2米以下儿童、70岁以上老人免门票；观光园内各娱乐项目另行收费。,5月-10月  8:00-22:00； 11月-4月  8:00-18:00,河北省秦皇岛市北戴河区海北路中段,
17761196,/poi/5437590.html,5437590,秦皇求仙入海处,4,来参观的人不在少数，秦皇的雕塑很高大，正好在风口处，进去之前，有不少的景点可以参观，到最后看到秦皇的雕塑基本就结束了，面朝大海，很威猛。,2014-04-11 15:56:13,　秦皇岛求仙入海处景区占地19万平方米，区内属温带海洋气候，林木苍郁，空气清新，风光秀美，冬无严寒，夏无酷暑。景区主体内容融古建筑、园林、雕塑为一体。其人文景观，依战国时代重大历史事件和传说，突出秦皇丘县拜海的壮观场面，是秦皇岛的标识性景区。主要景观有亲封阕门、秦皇东巡群雕、战国风情、仙人祠、求仙殿等30多个。当面海域则有秦皇号和求仙号两艘大型豪华游船，每艘游船能容纳近五百人观光游览。 　　战国风情为战国风情一条街、街市两厢再现齐、楚、燕、赵、魏、秦政治、军事、农业、手工业、商业、文化民俗特色。 　　望海大会暨求仙节是海港区的一项传统民俗活动，俗称”逛码头”，源于公元前215年秦始皇东巡到此拜海求仙。景区自1992年起恢复每年端午节的”望海大会”，园内举办大型舞蹈秦始皇求仙仪式。,97,0335-4041822,,,,学生票：17元 老人票：28元 大门票：35元 联票：80元,08:00—17:00,中国河北省秦皇岛市海港区南山街56号,
17761196,/poi/6818530.html,6818530,燕山大学,4,学校还可以，三本的里仁学院和院本部是分开的，有立交桥，站在立交桥上，能闻到海的腥味。出燕山大学的门，不远处就是一片海，还有小铁路，感觉还是比较不错的。,2014-04-11 15:56:18,燕山大学源于哈尔滨工业大学，始建于 1920 年。 1958 年哈尔滨工业大学重型机械系及相关专业迁至工业重镇齐齐哈尔市富拉尔基区，组建了哈尔滨工业大学重型机械学院。 1960 年成建制独立办学，定名为东北重型机械学院，隶属于国家机械工业部。 1978 年被确定为全国重点大学，是原机械工业部四所国家重点高校之一。 1985 年至 1997 年学校整体南迁秦皇岛市。 1997 年 1 月经原国家教委批准，更名为燕山大学。 2006年被确定为国防科工委共建高校，现更换为工业与信息化部共建高校。学校占地面积 5000 余亩，建筑面积100万平方米。现有教职工 2700 人，其中专职教师近 1700 人，教 师中 教授 323 人（含博士生导师 118 人），具有正教授评审权，副教授 363 人，长江学者特聘教授3人，享受国务院特贴专家76人，德国洪堡学者3人。现有普通高等教育在校生近 37000 人。学校现设有机械工程、材料科学与工程、电子科学与技术等 5个博士后流动站；拥有 6 个博士学位授权一级学科；拥有 35个博士学位授权二级学科专业，拥有 13 个硕士学位授权一级学科， 80 个硕士学位授权二级学科专业；有 15 个工程硕士专业学位授予权领域和 MPA 、 MBA 专业学位授予权，有 60 个本科专业，已呈现出以工为主，文、理、经、管、法、教等多学科并举的学科格局。学校现设有 18个学院1 个校管系 ，即：机械工程学院、材料科学与工程学院、电气工程学院、信息科学与工程学院、经济管理学院、建筑工程与力学学院、理学院、文法学院、外国语学院、环境与化学工程学院、艺术学院、车辆与能源学院、研究生学院、国际交流学院、里仁学院、职业技术学院、继续教育学院以及体育系。2007年8月燕山大学在美国俄亥俄州托力多大学建立燕山大学海外汉语教学中心即燕山大学托力多学院。学校设有5个国家重点学科、4个国防重点学科和11个省级重点学科；有“亚稳材料制备技术与科学”国家重点实验室、“极端条件下机械结构和材料科学”国防重点学科实验室、“精密塑性成形技术研究应用中心”国防科技工业先进技术应用中心、“国家技术转移示范机构 ”秦皇岛燕山大学科技开发总公司、 “轧制设备及成套技术”教育部工程研究中心和12个省级重点实验室和工程中心。其中5个国家重点学科分别为：*机械设计及理论 *机械电子工程 *机械制造及其自动化 *车辆工程 *材料学。学校在重型装备成套设备研制、并联式机器人、流体传动及电液伺服控制技术、精密塑性成形技术及设备、大锻件热处理、大块非晶技术、亚稳材料科学与技术、工业自动化等研究领域具有国际先进水平。1996年以来，学校连续获得国家科技奖励13项，其中国家科技进步一等奖2项、二等奖8项、三等奖2项、国家技术发明二等奖1项，承担“973”、“863”、国家自然科学基金和国家社会科学基金项目230余项。1999年，学校在秦皇岛经济技术开发区建立燕山大学科技园。2003年9月，燕山大学科技园被科技部、教育部批准为国家大学科技园，成为当时全国34家国家大学科技园之一。学校积极开展国际间的学术交流合作，先后与英国、美国、加拿大、德国、俄罗斯、乌克兰、爱尔兰、韩国及日本等国家的多所大学和研究机构建立了友好合作关系，双方互派访问学者，进行联合研究。燕山大学 4 万多名师生员工意气风发，锐意改革，正努力把学校建设成为立足河北，面向全国，走向世界的以工为主、以重型机械及装备为优势，多学科协调发展的高水平大学。学校领导 党委书记：孟卫东 党委副书记、校长：刘宏民该校在《2008中国大学评价》课题组编制的2008中国大学100强排名中名列第74位；2008中国大学工学100强排名47位；工学实力为B+行列。,87,0335-8057100,http://ysu.edu.cn,,,,,河北省秦皇岛市海港区河北大街西段438号,
17761196,/poi/5822537.html,5822537,集发生态农业示范观光园,4,很好，值得一去。很多热带植物，还有一些异域的植物，很大，还有一些小型娱乐项目，另外还有农村的小院落，值得一看,2014-04-11 15:56:22,是一个以生态农业为主题的参观地，园区被分为综合活动区、民俗展示区、吃住休闲区、观赏采摘区、娱乐项目区、动物表演区。观赏采摘区又分为四季花园、四季菜园、四季果园、四季瓜园、热带植物园、丝瓜长廊六大块，里面长满了各类奇异的植物、瓜果；娱乐项目区则是蹦极、高空滑索、攀岩、滑雪、滑草等普通娱乐项目。  这里不光可以看到上千种植物何40多种动物，还可以攀岩、蹦极、空中飞人；在戴河第一漂乘坐竹排欣赏两岸风光；在獐乐园荡秋千、踩滚桶；在水上乐园一展身手。同时还可在环境独特的农家饭庄品原汁原味的农家饭菜。,286,0335-4019002,,建议3-4小时,乘5路到太平庄下车，步行1km才能到,旺季（4月1日-10月31日）40元，淡季（11月1日-次年3月31日）20元，1.2米以下儿童、70岁以上老人免门票；观光园内各娱乐项目另行收费。,5月-10月  8:00-22:00； 11月-4月  8:00-18:00,河北省秦皇岛市北戴河区海北路中段,
17761196,/poi/9288.html,9288,星海广场,4,听说星海广场是亚洲最大的广场，还不错，而且大连的贝壳博物馆就在那边，个人感觉挺大的,2014-06-23 09:19:13,大连星海广场是亚洲最大的城市广场，为纪念香港回归而建。整座广场呈椭圆形，面积比两个天安门还大，中央大道贯穿广场中心，矗立着全国最大的汉白玉华表，999块四川红大理石散布广场各个角落，上面刻着天干地支、24节气和12生肖，突显了中国传统文化。 在星海广场不仅可以欣赏到巨型华表、音乐喷泉、各式雕塑，还可以观赏海景和夜景。重大节庆里，还能碰上骑着骏马的女骑警，见识她们飒爽的英姿；在夏季，大连啤酒节还会在这里举行，整个广场转身变成狂欢胜地。,2194,0411-84809653,,1-2小时,乘坐23、16、406、711、801路，202路轻轨电车等公交车在星海会展中心车站下车；公交404路到期货大厦站下车 从大连火车站打车约需20分钟，约20块钱车费,免费,全天,大连市沙河口区中山路572号,
17761196,/poi/13099.html,13099,海神庙Tanah Lot,5,我喜欢这里，这个地方一定要去，天蓝的都不真实了，海水也特别的蓝，跟蓝宝石似的，我觉得不虚此行,2014-06-20 12:14:09,海神庙是巴厘岛最重要的海边庙宇之一，始建于16世纪。海神庙坐落在海边一块巨大的岩石上，每逢潮涨之时，岩石被海水包围，整座寺庙与陆地隔绝，孤零零地矗立在海水中，只在落潮时才与陆地相连。每到傍晚18:30左右，日落同寺庙交相辉映，飞溅的浪花拍打岩石，实为壮观，神庙右侧有一突起岩石是拍摄日落和海神庙的绝佳地点。注意非印度教徒不能进去，但是可以在潮退的时候靠近神庙观赏。,5882,(62-361)880362,http://www.tanahlot.net/,半天,包车前往，从登巴萨出发约1小时车程，从乌布出发约40分钟的车程,"本地人 儿童：7500卢比/人 成人：10,000卢比/人  外国游客 儿童：15,000卢比/人 成人：30000印尼盾/人  停车费 摩托车：2000卢比 小汽车：5000卢比 大巴：10,000卢比",全年全天开放,"Desa Beraban, Kediri Tabanan, Tabanan",
17761196,/poi/5889552.html,5889552,猫的天空概念书店(渔人码头店),4,大家都推荐这里，所以这里的人很多啊，进去寄了几张明信片就走了，实在是人多，不过可以各种拍照，没有人会管你的，餐饮价格比较小资，个人不喜欢熙熙嚷嚷的书店，还是觉得安静一点儿会更有书店的氛围,2014-08-04 10:19:18,,,,,,,,,,
17761196,/poi/1670.html,1670,天津之眼The Yongle Bridge Tientsin Eye,4,门票忘记多少钱了，摩天轮转的很慢的，好像所有的摩天轮都很慢哦，然后一个小格子里面可以坐四个人吧（忘记了，大概是），在最高点可以看到天津全景，我们去的那天还下雨咧，晚上灯亮起来的时候很漂亮，主要就是架在了桥上，天津之眼么，推荐看夜景，没必要一定要乘坐,2014-08-06 14:26:07,天津之眼坐落在天津市红桥区海河畔，是一座跨河建设、桥轮合一的摩天轮，兼具观光和交通功用。 摩天轮旋转一周所需时间为28分钟，到达最高处时，周边景色一览无余，甚至能看到方圆40公里以内的景致。 可看到方圆40公里以内的景致。 摩天轮转动速度缓慢，并不刺激。你可眼见车辆从两边疾驰而过，别有妙趣。 传说摩天轮上的每个盒子里都装满了幸福。与爱人相偎相依，叫人如何不想把握住此刻的幸福与浪漫。,2656,022-26288830;022-23343557,,28分钟旋转一周,乘34、4、607、611、640、659、673、802、841、849、863、869、878路等公交车在五马路站下即是。,成人70元，包厢票400元（限5人以内单独乘坐）。,9:30-21:30，每周一上午摩天轮例行检修，不对外营业（节假日除外）,天津市河北区五马路永乐桥,
17761196,/poi/1669.html,1669,意大利风情街,4,虽然是很久之前去的，但是这周末要去北塘区捕鱼，所以想起来风情街，真的挺不错的，有很多是西方的建筑风格，然后参观的人算不上拥挤，让我觉得比较有格调，因为在北京，所以我相信我又很多机会去到天津，很方便，希望有一天辞掉了北京的工作，一个人去天津溜达一圈。,2015-08-07 10:36:46,意大利风情街是意大利本土之外面积最大的意大利建筑群，近年天津最热门的景区之一，地方不大，却值得走走逛逛，很多拍婚纱照的在此选景。 因欧式风情与名人古宅的相间融合，漫步其中，仿佛置身国外，又有深厚的文化底蕴包围。 在意大利老租界里，还有梁启超的饮冰室、曹禺故居、意大利兵营旧址等。  不少电影如《南京！南京！》《非常完美》也曾在此拍摄。,3675,022-24454471;022-24466187,,1-2小时,乘5、8、27、634、638、638区间、639、645、645区间、663、672、676、 802、806、806区间、832、836、905、961路等公交车可直达。,免费,全天,天津市河北区自由道25号（海河沿岸）,
17761196,/poi/3915.html,3915,天津和平宾馆,4,说实话并没有进去，和平宾馆有很多为人曾经住过，在外面参观的时候，会看到住过的伟人的名字，所以有机会的话可以去体验一下，很值得一去,2016-02-02 09:02:11,,,,,,,,,,
17761196,/poi/5423596.html,5423596,翠华餐厅(旺角店),4,说实话，找这个餐厅找了好久，三个人拿着手机，跟着地图晃荡，走了不少冤枉路，我们是早上到的那儿，真没觉得有多好，可能还是太累了的缘故，服务也不尽人意，香港对大陆游客的态度普遍不好，让我觉得不是很痛快，习惯性给好的评价，吃食还可以吧，毕竟是许多人推崇的地方,2016-01-12 10:41:21,,,,,,,,,,
17761196,/poi/666.html,666,龙城大药房,5,人真的是很多，而且老板服务员什么的态度很不好的，但是东西也蛮多，而且价格相对来讲是很实惠的，推荐去看一看，如果不怕挤，而且有耐心淘的话就会觉得还是很不错的，反正人是真的多到爆，老板态度很不好,2014-07-09 14:35:22,,,,,,,,,,
