uid,poi_href,poi_id,name,star,content,datetime,description,pics,tel,site,time,traffic,ticket,opentime,location,insides5193922,/poi/3751.html,3751,八大处公园,4,很喜欢这里，可以躲开香山的人潮，一样看到美丽的红叶。还有人文代表的寺院可以欣赏。喜欢！,2013-11-27 09:58:18,八大处公园位于北京西郊五环外，西山森林公园旁边，八大处是指园内的八处佛教寺庙，八大寺庙大多历史悠久香火旺盛，很多自古以来就是京郊拜佛祈福的胜地。几大寺庙都建在公园内的小山上，山间树木茂密，搭配着古朴庄严的寺庙园林显得非常静美，山上还有很多银杏、枫树等，每到秋天红黄的树叶十分漂亮，来此散步观景、登山拜佛都十分不错。 八大处公园内山不算高，均有台阶路，从景区门口一直爬到山顶约需步行四五公里左右，适合爬山锻炼。若专门爬山需要2-3小时，若一路拜佛观景则需要4-6小时甚至更久，一般从北京市区前来游玩都要准备一个整天。如果体力较差或者有老人小孩等同行，也可以选择景区内的索道和滑道，尤其是滑道从山顶而下，十分刺激，特别适合带小朋友体验。 公园内的八大处分别是指一处长安寺、二处灵光寺、三处三山庵、四处大悲寺、五处龙泉庵、六处香界寺、七处宝珠洞和八处证果寺，其中除一处长安寺现在还封闭外其余七处都对游客开放。其中二处灵光寺建于唐朝，寺内供奉着一颗佛牙舍利，此舍利在全世界仅存两颗，所以在佛教寺庙中非常著名，传说也十分灵验，所以灵光寺也是八大处公园内拜佛祈福最为集中的地方。四处到七处的寺庙都以景色为主，其中六处还是当年皇帝的行宫，所以布景如园林一样，十分精美，周围的山色也都很漂亮，所以在游览时是以观景为主。四处有郁郁葱葱的古银杏树，五处有清澈灵秀的龙泉，六处的建筑气势又精致，七处则是观看京城全景和日出的好地方。 除了八大处之外，最近发现的摩崖谷被称为“第九处”，谷里的石崖上有多处明代时雕刻的佛像和菩萨像，几百年来一直藏于山中，可以前去观看。另外还有冰川漂砾等景点，走过时可以简单看看。除众多景点外，光是来此观看山色、登山锻炼，也都是不错的选择。,260,010-88964661,http://www.badachu.com.cn,2-6小时,公交： 乘347、389、598、958、972路在八大处站下。地铁2号线积水潭站、西直门站和地铁4号线动物园站可换乘347路，地铁1号线玉泉路站可换乘389路，八角游乐园站可换乘598路，古城站可换乘958路，苹果园站可换乘972路。 自驾： 西五环路八大处出口下，沿八大处路约2km即到；或者西四环四季青出口下，沿杏石口路至八大处路。距门区不超过100m，有三个停车场，共计1200个车位，停车费10元。,门票10元，北京60-65岁（不含65岁）老人、外地60岁（含）以上老人、学生、1.2米-1.4米儿童半价，北京65岁（含）以上老人、1.2米以下儿童免费。索道及滑道成人票单程50元，往返（上山为索道，下山索道、滑道可选）套票100元；1.4米以下儿童索道单程25元，滑道30元，往返（上山为索道，下山索道、滑道可选）套票50元。,旺季（3月16日-8月31日）6:00-18:30开放，19:30静园 平季（9月1日-11月15日）6:00-18:00开放，19:00静园 淡季（11月16日-次年3月15日）6:00-17:30开放，18:30静园,北京市石景山区八达处路3号,八大处香界寺|八大处龙泉庵|八大处大悲寺|八大处宝珠洞|八大处三山庵
5193922,/poi/4129.html,4129,北京凤凰岭自然风景公园,5,清明时节很美的地方，漫山遍野的山杏话，置身其中，真正有落英缤纷的感受，很美！,2013-11-27 09:58:48,北京凤凰岭自然风景区位于海淀区苏家坨镇凤凰岭路19号，距天安门33公里，总面积17.88平方公里，有人将“京西小黄山”之美誉冠之凤凰岭，景区内，峰、石、林、泉等自然景观，与寺庙、刻字、佛塔、香道等人文景观互映成趣、相得益彰。探寻凤凰岭，可以有三条线路：北线、中线、南线，北线可观流泉飞瀑、宝塔洞穴，中线为京西名刹之一的龙泉寺及北京最大摩崖刻字等，南线是佛教(黄普院)、道教(吕祖洞)、儒教(关帝庙)等宗教文化的荟萃之地,342,010-62455933,,,,门票25元,,北京市海淀区苏家坨镇凤凰岭路19号,
5193922,/poi/5426741.html,5426741,天生桥瀑布群,3,天生桥瀑布群没什么可说的，景色就那么回事吧，没有什么特别，好玩程度也一般，人也较多，就不推荐了，不过距离近的话，去避避暑还是可以的~,,本旅游区为一处以中山和亚高山地貌为特色的自然风景区，境内峰峦叠嶂，沟壑纵横，溪瀑多姿，植被茂密，风景雄奇险秀，每年的5至10月份看瀑布赏流水，6至9月看高山草原、原始次生林、百草百花，10月看苍山红叶、秋林云海，11月至次年3月，看冰挂雪雕、林海雪原，全年早观日出晚看暮霞，赏孤石怪山，虫鸣鸟叫，天桥奇观，一年四季景色各不相同，游乐其中，令人流连忘返，是一处难得的高品位的旅游胜地。,47,0312-7855555,,,,门票65人民币,08:00~16:00,河北省保定市阜平县天生桥镇朱家营,
5193922,/poi/5426741.html,5426741,天生桥瀑布群,3,天生桥瀑布群最大的卖点是10个大大小小的瀑布，不过其实端午的时候，还算干旱，水其实也都是水管打上去的，意思不大。 天生桥瀑布群没什么可说的，景色就那么回事吧，没有什么特别，好玩程度也一般，人也较多，就不推荐了，不过距离近的话，去避避暑还是可以的~,,本旅游区为一处以中山和亚高山地貌为特色的自然风景区，境内峰峦叠嶂，沟壑纵横，溪瀑多姿，植被茂密，风景雄奇险秀，每年的5至10月份看瀑布赏流水，6至9月看高山草原、原始次生林、百草百花，10月看苍山红叶、秋林云海，11月至次年3月，看冰挂雪雕、林海雪原，全年早观日出晚看暮霞，赏孤石怪山，虫鸣鸟叫，天桥奇观，一年四季景色各不相同，游乐其中，令人流连忘返，是一处难得的高品位的旅游胜地。,47,0312-7855555,,,,门票65人民币,08:00~16:00,河北省保定市阜平县天生桥镇朱家营,
5193922,/poi/901211.html,901211,龙潭湖风景区,5,看上去没有路的龙潭湖，其实往里面走便是当地旅游局将要重点推出的峡谷景区，只不过正 在修路，所以完全挡上了，又是峡谷，所以开始车绕景区时根本看不到的。后来听了当地农家的指引一路绕过茅屋，跨过小溪，向着发出隆隆机器声的地方行走，不久便来到正在修建的峡谷入口，向里迈进，几分钟之后便听不到机器的轰鸣了，映入眼前的是没有开发的天然峡谷，耳边围绕着不同的鸟鸣~~自然形成的白色河床 石滩衬着随意生长的各种绿植，偶尔消失不见又忽然冒出的小溪水流~~没有任何人工布道，完全自己研究如何前行的天然野趣让我惊喜不已……可以低头在石滩中 寻觅美丽的小石子，可以把小溪“截流”自造一个“小湖泊”，可以沿着山上人家踩出的小路试着上山，还可以藏在草丛中快行绕到同伴身后吓人……一路前行需要在水面宽阔的地方自己搬来石头一步一搭前行的路，也会被清晨的露水打湿鞋面……那感觉实在妙不可言，哈哈哈，天地之间尽归己有的感觉啊~~,,,,,,,,,,,
5193922,/poi/13743.html,13743,赤柱卜公码头,4, 大爱这个黑色铁艺的码头，好漂亮，TVB电视剧里出现很多次的地方了吧，我心中它比看美利楼还要是赤柱的标志。,,,,,,,,,,,
5193922,/poi/6047461.html,6047461,赤柱市场Stanley Market,4, 赤 柱市集~~~~多数店家都不准拍照，仔细找找还是可以淘到喜欢的东西的，ps：很多店家未明码标价的，您就可以施展您的口才了~~~不过这里不像女人街、 庙街，划不下多少，而且很多人看你划价会冷眼，自己要选择好……偶个人喜欢在明码标价的地方淘，或者和老板聊天，让他自己让些利,,,,,,,,,,,
5193922,/poi/6042482.html,6042482,赤柱正滩Stanley Main Beach,4,赤柱的正海滩，这边可以游泳什么的，是海上活动中心，冲浪，风帆……人相对多，我个人喜欢”八间屋“对着的那一小片海。沙滩、落叶，宁静的小海湾……,,赤柱正滩是香港南区一个泳滩，位于香港岛赤柱东部，邻接赤柱市集，为当地的一个旅游景点。该泳滩现时由康乐及文化事务署管理。,65,,,,,,,香港赤柱东部,
5193922,/poi/5513790.html,5513790,赤柱海滨长廊,4,每次到香港赤柱都是必去的一个地方，一向喜欢将行程计划的好好的，抓紧一切时间多走多看的我，每每到了这里便会不由得懒惰起来，滨海长廊边的座椅也好，海 边小酒吧的露天遮阳伞下也罢，最好是在最爱的海滩边倚树而坐，吹着海风，捧本喜爱的书，又或就那么呆呆地一个人坐一个下午，仿佛可以忘记时间，忘记一 切……,,,,,,,,,,,
5193922,/poi/29367.html,29367,九漈石门台,5,很美，人不多，喜欢！！！瀑布很有特色~~避开人潮的好去处，十一都在包场游！,2014-10-31 11:24:57,石门台位于大若岩景区陶公洞北约3公里处，因一溪谷有九瀑而出名。九漈之奇，奇在瀑有九级。九漈不是一瀑九级，而是九条瀑布。九瀑源流，当是一脉，然一瀑一形，一瀑一景，层次分明，自成首尾。对于观瀑者来讲，像这样在不到三公里的一条溪涧中，能见到姿态多变、景色各异的九级瀑布，实为世上罕见。九漈飞叠，源出一脉，一漈一形，一漈一景，气韵生动，首尾呼应。 第七漈高约40多米。瀑布沿85度陡坡飞落，跌入碧潭，水势激荡，银光闪烁，四围绿树成荫，不见天日。潭口凉风飕飕，寒气袭人。集雄奇、险峻、清幽、秀丽于一体，堪称绝景。 第八漈高8米，瀑分二股如燕尾向下奔流，瀑布处于两峰夹峙间，仅露一线天，潭边野兰馥郁，芳香扑鼻。 第九漈高20多米，四周峭壁高围，封闭似井。瀑自崖巅飞泻而下，瀑声轰鸣，四壁震荡，嗡嗡如闷雷。瀑入碧潭，水花飞溅，犹若雪浪翻滚空谷。潭口有石门台，高约3米，上宽2米，下宽1.5米，水从石门台中流出。石门台外，有一条凸起2米高、5米长的石门槛，涧水入石门槛从两端分流而下。,70,0577-67121181,,1-2小时,温州火车站乘33路公交车到安澜亭码头轮渡到瓯北，乘往岩头方向的中巴，车资11元，1个多小时可达,成人票：30元；1.2米以下儿童及军人和新闻记者免票；1.2米-1.5米儿童：15元,8：00-17：30,浙江温州市永嘉县永嘉县大元下村(陶公洞北约3公里),龙溪
5193922,/poi/29366.html,29366,百丈瀑,4,瀑布一般，只有一条大的，很高，天气好可以看到瀑布接近水潭的地方有彩虹，景区外面的风景很美很美，晴朗的日子，蓝天白云加上云雾环绕的群山和稻田，很赞,2014-10-31 11:27:15,百丈瀑位于楠溪江大若岩景区，又名傅岩瀑、府岸瀑。瀑布高124米，为浙江第二大瀑布。瀑布从124米的高崖飞出，瀑旁三面合围，崖壁直立，稍内凹，似大玉甑的纵切面，瀑从高崖上飞出，疑为白绫千尺，银河倒悬。 随着季节气候不同，瀑布形态也奇谲多变。雨季水旺，瀑如玉龙飞降，骏马奔腾，瀑风袭来，五六十米之外湿透衣襟。到了旱天，瀑成缕缕银丝，缥缥迷蒙，人坐潭边，舒心惬意。,6,,,,从陶公洞出发，乘当地三轮车约十分钟到大若岩镇傅岸村下车，再从傅岸村缘小溪蜿蜒北行，至“瀑布寮”折西走一小段山路，登上“虎愁崖”，共步行约10分钟即到,,,浙江温州市楠溪江大若岩景区内,
5193922,/poi/5428481.html,5428481,楠溪江狮子岩桃花源竹筏漂流,3,没有原来好了，价格贵路程短~~~感觉不够实在，节假日人多，很乱，破坏景观，不如在岸上看景的，漂流一定找人少的地方才好,2014-10-31 11:29:32,,,,,,,,,,
5193922,/poi/4116608.html,4116608,正江山林场龙湾潭森林公园,5,大爱，很漂亮很漂亮，门口的水有九寨的感觉，瀑布很美，山也很大，在上面向下看果然很像一条龙盘在山间,2014-10-31 11:33:32,,,,,,,,,,
5193922,/poi/1241.html,1241,武侯祠,4,之前有好几个朋友不推荐进去的，票价不菲，60米，说是没什么，不过本着我当了 若干年诸葛先生崇拜者的缘故，这个还是看下吧！这边的仿古建筑好多，修得也都蛮有味道的。  也许是期待不高所以反而惊喜，又或者是自己来得够晚又非节假日，以至于没有什么游客，让我这个贪清静的感觉很享受，总之里面给我的感觉很好的，可以说是这几天几个景点中让我印象最深，呆的最舒服的了。 园 中的景致大气不失秀丽，几步一景，有汉代留下的残住，有岁月沉淀下的乌木，不似北方宫殿的磅礴大气，也不像江南园林的温婉，有种独特的味道，说不出~~一 个人徜徉其间，有种历史凝固了的感觉，不会形容，又或许这些多是后人修缮并没有什么当年风格，没有深入研究，但此时此刻配合心境，我喜欢这里！,,成都武侯祠肇始于公元223 年修建刘备惠陵时，是中国唯一一座君臣合祀的祠庙，是最负盛名的诸葛亮、刘备及蜀汉英雄纪念地，也是全世界影响最大的三国遗迹博物馆。如果你也是“三国迷”，那么这里一定能满足你对历史的渴求，若不想被人声打扰，最好尽量在早晨刚开门时入内参观。 成都著名的锦官深处——“红墙竹影”就在这里，不要忘记拍照纪念。,5883,028-85552397;028-85535951;028-85588596,http://www.wuhouci.net.cn/,2小时,乘1、57、82、334、335 路至武侯祠站下车；乘8、21 路至武侯祠东街站下车,通票60元，学生票30元，家庭套票120元,旺季8:00-21:30（7月1日-10月7日），淡季8:00-18:30（10月8日-次年6月30日）,四川省成都市武侯区武侯祠大街231 号,
5193922,/poi/1242.html,1242,锦里,4,据说华灯初上的锦里是最美的，时间刚刚好~~~想说，这里人真多啊，等啊等啊等，也拍不到个没有人的，后来据说这张 已经算是超级好运了~~这里什么时候都是人声鼎沸的！好吧，已经开始兴趣缺缺了，我就这样，无论你再好的风光，人多一乱我便烦，远不如一个无人的风景一般 的地方让我尽享清闲。 里面的建筑都还是很有特点的，至少与北方不同，看着新鲜 很喜欢这条巷子，其实很想拍张照片留念的，但是实在是犯懒找人帮忙，哈哈，这边是一个人游玩最大的缺点了，不过好在自己是那种拍可以拍很久不累，不拍也不觉得什么，美景留下就ok的那种人，所以无所谓了,,锦里是一条仿古商业街，成都人气最旺景点之一。在这里，你可以欣赏捏泥人、摆糖画的手艺，逛逛极富三国特色的店铺、皮灯影、曹营坝、筷子店等，还可以到永远人头攒动的“好吃街”品尝四川名吃，还有茶楼、咖啡馆、酒吧、客栈等随时可落座。黄昏时分，锦里会亮起灯，颇有韵味，适合拍照游玩。,14564,028-66311313;028-85511800;028-85538914,http://www.cdjinli.com/,2小时,乘1、57、82、334、335 路至武侯祠站下车；乘8、21路至武侯祠东街站下车,免费,5:00-23:00,四川省成都市武侯祠大街231 号附1 号(武侯祠东侧),
5193922,/poi/2527696.html,2527696,安顺廊桥,4,这个始建也很早，马可波罗的游记里都有呢，当然这个廊桥也是后期重建，年龄更小，2003年才重建好，但外观据说复原的很好的~~~具体如何不知，不过夜景真心不错的说。,,,,,,,,,,,
5193922,/poi/13732.html,13732,都江堰景区,4,成都这边景点门票真贵！都江堰90元，这一趟的所有门票钱真心让人心痛啊~~~是个美丽的城市，但是我更爱HK那样免费随便可以看美景的地方！！！！自然遗产是大家的，圈地赚钱！！！鄙视它！   人满为患的景区了，总能被我这个爱清静的找到无人搭理的地方自得其乐，这片仿佛小森林的地方，很赞！木有人，哈哈，但十几步穿出去就又是人声鼎沸的了,,建设于古代并使用至今的大型水利工程，是全世界迄今为止，年代最久、唯一留存、以无坝引水为特征的宏大水利工程，被誉为“世界水利文化的鼻祖”。  这座坐落于岷江上的大型水利工程，由战国时秦国蜀郡太守李冰及其子于约前256年至前251年主持始建，两千年时光荏苒，依然发挥重大作用。 这项工程主要有鱼嘴分水堤、飞沙堰溢洪道、宝瓶口进水口三大部分构成，科学地解决了江水自动分流、自动排沙、控制进水流量等问题，消除了水患，使川西平原成为“水旱从人”的“天府之国”。 都江堰附近景色秀丽，文物古迹众多，主要有伏龙观、二王庙、安澜索桥、玉垒关、离堆公园玉垒山公园和灵岩寺等。,6117,028-87120836;028-87283890;028-87293800,http://www.djy517.com/,半天或1天,1、汽车：在茶店子汽车站乘直达都江堰的汽车，发车时间为 6:30-19:00，车程约1 小时，票价17 元 2、动车：在成都犀浦乘至都江堰火车站的动车，车程30 分钟左右，票价10元/ 人  3、自驾：成灌高速,成人票90元，学生凭证可购优惠票45元；四川省及省外老人凭证购半票；70周岁以上（含70周岁）老人凭证免票（黄金周期间所有老年证均需购半票）；讲解器10元（另付费） 景区观光车车票往返15元，单程10元（从碑亭-鱼嘴）,8:00-17:30（12月1日-3月1日） 8:00-18:00 （3月2日-11月30日）,四川省成都市都江堰市灌口镇公园路,鱼嘴分水堤
5193922,/poi/30935.html,30935,安澜桥,4,安澜索桥的另一边，不开放的，但更古朴的味道，比加固后站满人的感觉更好，可惜那边没研究出来怎么过去~~ 通过安澜索桥，木有目标一路哪里安静哪里跑~~就被我找到了这种大爱的到处绿苔的地方了,,二王庙前的安澜桥是我国著名的五大古桥之一，横跨在内江和外江的分水处，是一座名播中外的古索桥。 古老的安澜索桥下，是滔滔江水，奔流不息的汹涌，有勇气的蜂蜂一定要上桥走一遭。以前水量大的时候，浪花可以直接拍到脚面，让你惊心不已，非常刺激。当然现在加固了许多，但不少人从这走过时还是会故意晃桥，胆小或有恐高症的人可要抓紧走稳了，免得被吓着。 尽管晃悠，但索桥两侧保护得很好，是个拍照的好地方，但一定还是要小心，保护好相机。,177,028-87283890;028-87136609;028-87120836,,10-30分钟,在都江堰景区内步行可达,含在都江堰景区门票内（90元） 景区观光车车票：往返15元，单程10元（碑亭至鱼嘴）,12月1日-3月1日：8:00-17:30；3月2日-11月30日：8:00-18:00,四川省都江堰市都江堰景区鱼嘴分水堤之上,
5193922,/poi/6325179.html,6325179,玉垒山,4,登上塔往下望去，真心好宏伟震撼！两千多年前的水利工程灌溉了整个成都平原啊~~,,玉垒山位于二王庙东侧，原是一个公园，目前容纳至都江堰景区内。 山上古木参天，绿荫如盖，还有一段明代古长城，本地人常到此晨练。游玩都江堰后，可到此登顶上玉垒阁俯瞰都江堰，特别美，值得一去。登山最好穿轻便的鞋子。,58,,,30分钟,在都江堰景区内步行可达,含在都江堰景区门票内（90元） 景区观光车车票：往返15元，单程10元（碑亭至鱼嘴）,12月1日-3月1日：8:00-17:30；3月2日-11月30日：8:00-18:00,四川省都江堰市都江堰景区内,
5193922,/poi/30936.html,30936,南桥,4,水流很湍急~~喜欢这种感觉     南桥在汶川地震期间基本毁了，这个是翻修后的，看着就很新，哈哈，不过还是很精致漂亮就是了~~,,南桥是南街与复兴街之间的一座雄伟壮丽的廊式古桥。 若论人气，南桥应当不亚于都江堰水利工程内的任何一处。南桥不仅有精致的门楼，桥梁更是修建得雄伟壮观，结构考究，桥上还有各种彩绘、雕梁画栋，令人赏心悦目。除此外，南桥上的小吃恐怕是其魅力所在，桥边河畔是条热闹的美食街，有各种小摊饭馆及化妆成卡通人物的艺人表演。 入暮后的南桥灯光旖旎，是拍夜景的好去处。白天游完都江堰，晚上到此小坐，吹着江风，惬意无比。,668,028-87283890;028-87136609;028-87120836,,任意,在都江堰景区内步行可达,免费,全天,四川省都江堰市都江堰景区与灌县古城之间(南街与复兴街之间),
5193922,/poi/1239.html,1239,金沙遗址博物馆,4,0大元~~贵啊~~~没办法，谁让我想看这个的！ 博物馆园区里的乌木林，在成都这个好特色呢，各大景区或多或少都有这个，没仔细研究过，只知道，是楠木、红椿、麻柳等树木因自然灾害埋入淤泥中，在缺氧、高压状态下，经过长达成千上万年的碳化过程形成的。年代越久，保存越完好，价值也越高。这一堆，应该算宝贝了吧 整个遗址仿佛一个大公园，绿化植被极好，不知道以为到了什么公园~~~成都的各个景点都有这么一个特点，不论是那种类型的，植被都很好，每个都能让人有一种感觉这里适合发呆一天的感觉，就是门票贵啊啊啊啊,,金沙遗址是二十一世纪初中国第一个重大的考古发现，这是一处商周时代遗址，出土了世界上同一时期遗址中最为密集的象牙、数量最为丰富的金器和玉器。其中最富盛名的是位于第四展厅的“太阳神鸟”金箔，被确定为中国文化遗产标志和成都城市形象标识主图案。 感兴趣的话，还可自付费欣赏4D 影片《梦回金沙》，或在晚上到金沙剧场欣赏世界首部在考古遗址原址上演的音乐剧《金沙》，置身其间，观众宛如穿越“时空隧道”回到了3000 年前的古蜀王国。,2173,028-87303522,http://www.jinshasitemuseum.com/,3-4 小时,乘5、79、82、83、84、100 路等公交至青羊大道北站或金沙遗址东门站下车，再步行约200 米可达,门票80 元，学生票40 元；1-10 人讲解50 元，租用语音导览 器10 元/ 次； 4D 影院门票20 元/ 人； 《金沙》音乐剧乙票180 元；甲票280 元；特票380 元；VIP 票580 元,8:00-18:00（17:30 停止售票）；《梦回金沙》片长15 分钟，每隔1 小时循环播放，最后一场为17:00；《金沙》演出时间为每晚20:00，演出时长90 分钟,四川省成都市青羊区城西金沙遗址路2号,
5193922,/poi/5002.html,5002,青羊宫,4,好吧，有些地方注定缘分不够，没有看到朋友们形容的景致，到处都是整修进行中的痕迹，完全一片施工现场的 样子,,青羊宫是川西第一道观，宫内保藏有清代光绪三十二年(1906) 所刻《道藏辑要》经版，为当今我国道教典籍保存最完整的存板。青羊宫内遗留建筑基本为康熙年间重建，唯有斗姥殿是仅存的明代风格。 对老庄经文、推拿养生感兴趣的游客还可到老庄书院听讲座，具体日程提前见官网。,1796,028-87766584;028-87710035,http://www.qingyanggong.org,1小时,乘11、19、27a、27、34a、34、35、42、58、59a、59、82、129、151、165、170、309、319 路公交至青羊宫站下车,门票10元,夏季8:00-18:30，冬季8:00-18:00,四川省成都市青羊区一环路西二段9号,
