uid,poi_href,poi_id,name,star,content,datetime,description,pics,tel,site,time,traffic,ticket,opentime,location,insides
41437188,/poi/6196.html,6196,光谷步行街,4,这里是败家娘们和吃货的天堂哈哈,2016-05-23 08:11:18,,,,,,,,,,
41437188,/poi/5426285.html,5426285,黄鹤楼Yellow Crane Tower,4,黄鹤楼很有名气，我是慕名而来，登黄鹤楼，仿佛古人离我们不远，但今日的黄鹤楼没有了诗词里面的感觉了,2016-05-23 08:10:31,黄鹤楼位于武昌江畔，紧邻长江大桥，有“天下江山第一楼”的美誉，是地理上武汉的中心。因为建于蛇山之上，再加上5层的楼高，以及周边无高层建筑，所以这里的视野非常开阔。除了黄鹤楼之外，景区内还有大量的石碑、石刻，都是历代名人的真迹。这里绿化非常高，不行在山间非常惬意。每天在落梅轩还有楚地特色的编钟表演，时间分别为10:00，11:40，14:20，16:00，表演免费。,4314,027-88871394,,2小时,电车1路、电车4路，公交10、61、64、108、401、402、411、413、584等路到黄鹤楼站下。或者乘车在阅马场下车（参见首义广场交通）,A.免票政策：儿童在1.2m以下免票，70周岁以上的老人（凭身份证或老年证）免票，现役军人（凭现役军人有效证件）免票、残疾人（凭残疾人证）免票 B.优惠政策：身高1.2-1.4m购儿童票40元，60-69岁的老人（凭身份证或老年证）预订老年票40元，（本科及以下）持有效学生证购票40元,07:30—18:30(4月1日至10月31日)；07:30—17:30(11月1日至3月31日,湖北省武汉市武昌蛇山,
41437188,/poi/7047489.html,7047489,东湖植物园CS野战,3,这里种了很多植物，春天来这里感觉非常放松,2016-05-23 08:08:49,,,,,,,,,,
41437188,/poi/1647.html,1647,世界之窗window of the world,3,这里压根没有玩的娱乐设施，就是些世界景点的缩小版,2016-05-23 08:17:49,世界之窗公园中的各个景点都按不同比例自由仿建，按世界地域结构和游览活动内容分为世界广场、亚洲区、大洋洲区、欧洲区、非洲区、美洲区、世界雕塑园和国际街八大区域。作为以弘扬世界文化精华为主题的大型文化旅游景区，世界之窗荟萃了世界几千年人类文明的精华，有历史遗迹、名胜、自然风光、世界奇观、民居、雕塑等130多个景点，其中包括园林艺术、民俗风情、民间歌舞、大型演出以及高科技参与性娱乐项目等。,3622,0755-26602590;0755-26608000,http://www.szwwco.com,1天,"地铁1、2号线至世界之窗下车； 市内乘坐204,M388、222、223、230、232、234、245、M413、323、324、327、329,369路等公交车至世界之窗站下车",成人票：¥190 元 半价票：¥100 元,9:00-22:30 （如遇大型活动，时间以当日公布为准）,深圳市南山区深南大道9037号,
41437188,/poi/2365.html,2365,青青世界,3,门票60元，感觉就是小朋友玩的地方,2016-05-12 16:16:23,青青世界是一家以休闲度假为主题的观光农场，为“鹏城十景”之一。园区占地面积约20万平方米，景区为分侏罗纪公园、蝴蝶谷、瓜果园、陶艺馆、园艺馆等，另建有欧陆风情的木屋别墅、酒店客户、中餐厅、游泳池、钓鱼池等。园中的游乐项目有制陶、垂钓、蜡雕、手工纺织、编织中国结、城市农夫、制做唐山彩陶版画、蜡染等，妙趣横生，很能锻炼人的动手能力。此外，游客还可以参加足底健康步道、惊险吊桥、果汁屋、蝴蝶谷、茶寮、烧烤场等娱乐设施中的各项活动。青青世界为游客提供全木结构的半山度假木屋和海景酒店客房，客房设施都按四星级标准建造。园内的餐厅主要提供台湾菜和粤菜，此外也有商务套餐和快餐食品。,166,0755-26646988;0755-26403988,http://www.evergreen-cn.com,1天,1、公交：火车站乘地铁至“世界之窗”站，在地铁接驳站换乘42路大巴，直达青青世界； 2、乘坐公交42、81、369、M388、M372、M375、B802、B819路公交车至青青世界站下车。 3、从南山、蛇口码头出发：可乘210路大巴，直达“青青世界站”。 4、出租车：从罗湖、宝安方向打的约需30分钟；从福田、南山方向打的约需20分钟。,60元,08:30~18:00,南山区月亮湾青青街1号,
41437188,/poi/9952.html,9952,莲花山公园,3,景点玩的东西虽然少，但是很适合工作之余的放松和锻炼！,2016-05-12 16:07:30,莲花山公园位于深圳市中心区的最北端，全园占地面积194公顷，公园南区建有以棕榈科植物为主的、具有热带、亚热带风光的8万平方米的椰风林大草地，为游人提供了环境优美的活动空间，3万平方米的人工湖水质清澈 、环境优美，给公园增添了灵气，使游人享受划船和垂钓的乐趣。东南部建成16万平方米以大面积草地和微地形为主的风筝广场，市民在这里放风筝已成为深圳市的一大人文景观 ；东南面坡地种植有上万株凤凰木，每当夏季来临时，凤凰木花开，满山红遍，是莲花山非常壮丽的自然景观。,676,0755-83067950,,1-3小时,公交：莲花山公园站（到正门） 25路; 25区间线; 38路; 41路; 54区间线; 60路; 65路; 71路; 107路; 215路; 228路; 236路; 322路; 374路; 383路; b686路; k105路; k578路; m372路; m390路; n9路; 高峰专线19路 地铁：龙岗线（3号线）、龙华线（4号线）少年宫站F1出口（直走400米到正门或直走10米右转上台阶到风筝广场）,免费,6:00-22:30,深圳市福田区红荔路6030号,
41437188,/poi/29041.html,29041,东湖公园,3,小桥流水，景色可以，很适合亲子，情侣玩,2016-05-12 16:15:35,深圳市东湖公园原名“水库公园”，东连梧桐山，西临沿河路，南接深沙公路，北靠爱国路。深圳市东湖公园内有大家乐露天剧场、红荔书画馆、门球场，网球场四大文化娱乐设施。,160,0755-25410719,,,,,,罗湖区爱国路4006号东湖公园内（近人民检察院侧门）,
41437188,/poi/9964.html,9964,南澳旅游区,4,深圳烧烤，游水不来这里，你还想去哪里！哈哈不错,2016-05-12 16:14:17,南澳旅游区是著名的侨乡之一，位于大鹏半岛的最南部，东临大亚湾，南接太平洋，西连大鹏湾，与香港平洲岛对峙，相距不过千米。南澳居民多以捕鱼为生，每当夜幕降临，这里的海滨就会有渔歌唱晚的场景出现；逢年过节时还有各种渔灯会以及水上娶新娘等民俗可看。这里的海鲜在深圳最为有名，在南澳街头的餐馆里，鲍鱼、海胆等海鲜都可吃到。品海鲜之余，还可以租快艇游览附近小岛。,235,,,1-2天,公交车：在市内乘坐360直达南澳； 自驾车：南澳湾坐落在南澳镇畔，交通便利、道路平坦。开车过盐田，上盐坝高速公路，按路标指引即可到南澳。,免费,全天开放,深圳市大鹏新区南澳,
41437188,/poi/9979.html,9979,大梅沙海滨公园,3,我该怎么评论，我该说实话吗？算了还是不说吧,2016-05-12 16:13:39,大梅沙海滨公园共分游泳区、运动区、休闲区、娱乐区、烧烤场等区。有摩托艇、沙滩车、蹦极、TAGADISCO、水上降落伞、沙滩排球、沙滩足球等众多的游乐项目，并提供购物中心、冲凉寄存、餐饮供应、休闲品茗、泳具出租、保安、救生等配套服务。太阳广场属于公园的中心位置，公园西侧是月亮广场，太阳广场和月亮广场之间有432米长的阳光走廊，公园现种有57种亚热带植物，充分展现出亚热带海滨的自然风光。宽阔的沙滩上还分布有6个大小不等的张拉膜，张拉膜下面设置有供游人休闲品茗、冲凉更衣、洗手间等服务设施。,975,,,3小时,公交车： 387、103、J1、53、242、364、308、观光巴士1路，可在公园的月亮广场或太阳广场下车；208（到总站下车步行5分钟到公园的月亮广场）；360（到梅沙街道办站往盐田方向步行5分钟到公园内的太阳广场）；  自驾车： 广州出发：广州市区华南快线→广深高速→同乐边检站→广深高速→皇岗口岸出口→滨河大道→往罗湖方向直走（见火车站出口不要下）→罗芳立交→罗沙公路→盐田第二通道→盐坝高速→大小梅沙出口 深圳出发：市区→罗芳立交→罗沙公路→盐田第二通道→盐坝高速→大小梅沙出口,免费,6：00至次日1：00,深圳市盐田区盐葵路大梅沙段148号,
41437188,/poi/78206.html,78206,羊台山森林公园,3,感觉不爽，山顶没有东西卖，都是些小贩在卖水！,2016-05-12 16:06:39,羊台山气势宏伟，风光秀丽，海拔高度587米，是深圳西部最高峰。抗日战争时期，当地人民和东江纵队上演了震惊中外的“大营救”，从沦陷的港九孤岛抢救出了茅盾、何香凝、邹韬奋等著名爱国人士。羊台山也因此被称作英雄山。2008年，“羊台叠翠”被评为深圳八景之一。,86,,,,,,,广东省深圳市宝安区共乐路,
41437188,/poi/5422476.html,5422476,凤凰山森林公园,3,景点还行，不是很高，山顶有个广场，可以烧香和购物！,2016-05-12 16:04:25,凤凰山森林公园位于深圳市宝安区福永街道凤凰村，凤凰山主峰海拔678米，方圆1.2公里，素有凤山福水福盈地的美誉。凤凰奇拔峻秀，像一弯新月镶嵌在西海之滨，高悬在南国昊天沃土上，西眺伶仃洋，南瞰深圳湾。峰峦连绵叠翠，树木四季葱茂；百鸟啼鸣，花果飘香；山泉浅唱，壑洞幽藏，奇石多姿，古庙生辉。自然风景绮丽，人文景观丰富。水光山色，峭岩古洞，构成了一幅风光旖旎、雄伟壮观的山水画卷。凤凰山森林公园形如凤凰，停栖在浩瀚的零丁洋畔 。,144,0755-27391268,http://www.fhshan.com/,,1、从益田村出发坐367路下行，在福永中国电信下车， 前行右拐0米步行至美联购物中心 站换乘778路，在凤凰山路口下车，步行至凤凰山旅游区；或坐362路下行，在福永汽车站下车，后行100米步行至福永 香江家私城 站换乘778路，在凤凰山路口下车，步行至凤凰山旅游区 。 2、从福田区委出发，坐28路/202路/303路下行，在招商银行大厦下车，换乘 301路上行，在福永汽车站下车，后行100米步行至福永香江家私城换乘778 路在凤凰山路口下车，步行至凤凰山旅游区。,,6:00-22:30（冬天18:00封山，夏天18:30封山，22:30封园即广场、公园周边）,深圳市宝安区福永街道,
41437188,/poi/5259274.html,5259274,大岭山森林公园,3,2007年公司组织去的，感觉已经忘了，就知道腿软了,2016-05-12 16:11:13,,,,,,,,,,
41437188,/poi/5432867.html,5432867,观音山国家森林公园,4,来过两次了，走路上去非常的远呀！山上的东西老贵，但是景色不错,2016-05-12 16:12:55,　　广东观音山国家森林公园是国家林业局批准成立的东莞市首家国家级森林公园，位于东莞市樟木头镇境内，园区总面积18平方公里，森林覆盖率达99%以上，是集生态观光、娱乐健身和宗教文化旅游为一体的综合景区，被誉为“南天圣地、百粤秘境”。2006年10月，联合国国际生态安全合作组织又将广东观音山国家森林公园设立为国内第二家“国际生态旅游示范基地“。　　据统计，园内现有各种植物1000多种，动物300多种，原始次生林苍茫连绵，还有普渡溪、送子泉等水流，水质清醇。仙泉瀑布横挂山中。公园还规划有烧烤场、儿童乐园、音乐喷泉、观音寺等。,341,0769-87785936,,,,门票40人民币,07:00—17:00。,广东省东莞市樟木头镇石新区观音山森林公园。,
41437188,/poi/5439390.html,5439390,东莞旗峰公园Qifeng Park,3,还行，不用门票，市民的休闲锻炼场所,2016-05-12 16:12:06,旗峰公园位于莞城以南4公里的黄旗山，公园占地面积1600亩，内有山林公园、人工湖、植物园、黄旗古庙、黄岭道院、廉泉、黄旗山顶灯笼等自然和人文景观十数处，是游人踏青、了解东莞历史的好去处。“黄旗岭顶挂灯笼”是民间传说的东莞八景中的第一景。山下有始建于宋代的黄旗观音古庙，山麓有“廉泉”，尚存古井，传说饮一口廉泉水，可使人变得廉节。这里逢年过节，游人如鲫。东莞黄旗山又名祖山、主山、镇山、文笔峰、朝山。唐以前，曾是岭南第一名山。唐以后，一直是东莞人民春游、踏青、登高的圣地。明以后为东莞八景之一。明末抗清民族英雄张家玉九岁登黄旗山顶，誓作第一流人，并以自己的生命实现这一诺言，鼓励东莞人民上进、奋发、图强，为国争光，走向时代的前列。,24,0769-22463895,,,,,,中国广东省东莞市东城中路2号,
41437188,/poi/6645627.html,6645627,同沙公园,3,2007年误打误撞走路进去了，累的要死，天黑才走出来，太大了,2016-05-12 16:09:27,"同沙生态公园位于东莞东城区，号称东莞“都市绿肺”，于2006年5月1日开门迎客。它位于东城区南部107国道旁，占地面积40.2平方公里，山林30多平方公里，水面562.47公顷。其北侧为主城区，西北为新城市中心区，南侧为大岭山镇和松山湖科技产业园区。东西两个出入口。跨一区两镇（东城、寮步、大岭山）一场（同沙林场），西部与莞长路相，北部与环城路相通，交通十分便利，是市区调节生态平衡的“绿肺”。 整个同沙生态公园是环绕水库而建，靓丽洁净的柏油路，是骑车的好去处。这条蜿蜒15公里的环湖路，可以让游客饱览同沙生态公园的湖光山色。 园内最在七姐妹山旁还建了一条1．6公里的环湖小道，让游客穿行于湖心山间,怡然自得。环湖路共15公里，曲径通幽、移步异景，沿途树影摇曳、青翠流荡，漫步其间，可以呼吸新鲜的空气，尽情享受森林浴所带来的无限乐趣。",18,0769-22675268,,,,,,广东省东莞莞城区东城区南部107国道旁,
41437188,/poi/7054650.html,7054650,隐贤山庄,4,这个景点我去过5次，虽然小，但是也可以待上一天，哈哈,2016-05-12 16:08:16,集浏览、观光、游乐、拓展、度假为一体的综合型旅游度假区,39,,,1天,,联票（含景区内19项目）：90.00元 Tips：19项目含海盗船、遨游太空、从林飞鼠、鸟屋漂流、过山车、东莞最大的动物园、惊险历奇、广东第一大100米龙宫、大摆锤、摩天环车、飓风飞椅、神州飞碟、豪华无天网碰碰车、豪华转马、水上乐园、太空漫步、广东最大的哥伦布活鬼船、射箭场、炮兵基地。,08:00~18:00,广东省东莞市常平镇隐贤山庄大道8号,
41437188,/poi/2697.html,2697,孙中山故居,4,很久之前去看过，现在来评论，感觉那时候孙先生的家能建成那样好有钱的感觉,2016-05-23 08:02:58,孙中山故居纪念馆是以孙中山故居为主体的纪念性博物馆，坐落于广东省中山市翠亨村，在中山市区东南方17.6公里处，广(州)珠(海)公路主干道旁。北距广州约100公里，南距澳门约30公里，隔珠江口水域与深圳、香港相望，陆地与珠海市毗邻。翠亨村傍山濒海，气候宜人。优越的地理位置和优美的自然环境使孙中山故居纪念馆置身于林木葱茏、鸟语花香之中。交通：(1)从中山市区乘12路公共汽车可达该馆。12路车从富华总站出发途经富洲酒店、小商品市尝富华酒店、人民大桥脚、广寒冰宫、石岐药厂、京华酒店、库充、紫马岭公园、中山海关、明阳公司、陵岗、西江里、西垭、神涌、土草朗、榄边、南朗、泮沙、崖口、中山城、翠亨市场等站，时间约40分钟；或乘坐市内旅游巴士前往。(2)该馆邻近京珠高速公路广珠段翠亨出入口，南行进入珠海境内车程约5分钟，北上广州车程需1个多小时。(3)该馆至中山市客运码头中山港车程约20分钟。,186,0760-85501691,,,,免费,9:00～17:00,广东省中山市南朗镇翠亨大道93号,
41437188,/poi/385.html,385,帽子峰林场,4,秋天必须来的地方，来了就知道啥叫金秋,2016-05-23 08:15:18,著名的银杏之乡，这里四季鸟语花香，层峦叠翠，景色极美，也曾是游击抗战的革命圣地。,463,,,1天,南雄市区内包车前往，价格约40元左右。,30元,,广东省韶关市南雄市,
41437188,/poi/33314.html,33314,胡妃纪念馆,3,这里就是一个小小的纪念馆，可以烧香的，我没有进去过,2016-05-23 08:12:33,,,,,,,,,,
