uid,poi_href,poi_id,name,star,content,datetime,description,pics,tel,site,time,traffic,ticket,opentime,location,insides40501171,/poi/959.html,959,西子湾风景区,4,最好看的是落日，最值得看的也是落日，所以最好选黄昏的时候去吧,2015-01-02 13:39:46,西子湾位于高雄西隅，隔海峡与旗津岛相望，是一个风景天成的湾澳，北段倚靠寿山，是一处由平滩和浅沙所构成的海水浴场，是夏日玩水的好去处。长长的防波堤是西子湾的标志，徜徉堤上，海风吹拂令人心旷神怡，眺望海洋，堤外就是高雄港第一港口船只进出的水道，大小船只棋布在海面上，大船入港衬着呜呜船笛的景角在眼前历历上演。 黄昏是游西子湾的最美时刻，海潮覆岸，前来欣赏夕阳红霞及看船的人影在堤防上成双成群，画面美不胜收。,1755,(886-07)5215187,,1-3小时,"捷运： 在高雄高铁站（左营站）和高雄火车站搭乘捷运红线至美丽岛站，换乘捷运橘线至盐埕埔站或西子湾站下转公车。  公交： 1. 于捷运西子湾站2号出口搭乘99路、橘1线公交，至西子湾站下车即可。 2. 于捷运盐埕埔站搭乘99路公车可沿线在西子湾站、中山大学行政大楼站、海水浴场站下车皆可达。  自驾： 沿鼓山路往西子湾方向行驶,遇临海二路右转直行即可到达西子湾风景区。  景区内： 公交： 橘1A线，橘1B线，99路公车途经景区内几个景点。  租自行车： 西子湾捷运站1号口向左，有自行车出租店，9:30-21:00营业。 另外捷运站口就有政府运营的公共租车点，刷visa信用卡就可以租车，租车系统24小时运行。搭乘捷运后，30分钟以内租骑公共自行车，可以享受转乘优惠，同时仍享有第1小时内免租车费。景区内有专门的自行车车道，连接各个景点，沿海骑行还可以欣赏风景。",西子湾免费，西子湾海水浴场全票70新台币；半票30新台币，适用身高120cm以下儿童。,户外空间全天开放；  西子湾海水浴场：周一至周五10:00-19:00、周六与周日9:30-19:00,高雄市鼓山区莲海路70号,
40501171,/poi/960.html,960,打狗英国领事馆The British Consulate at Takow,3,里面团队游客还是蛮多的，可看的地方也不是很多，但站在高处可以看到中山大学全貌。,2015-01-02 14:06:55,打狗英国领事馆是台湾第一栋建造完整坚固的洋房，洋楼建在一个小山丘上，地理位置十分优越，西临台湾海峡，是货轮出入高雄港的必经之路，东面对着高雄市，可以俯瞰高雄市区和港口。从哨船头派出所旁边的小斜坡仰望，犹能感觉这座红砖老城门雄峙坚屹的气势，虽然城门屡经重修，两边民舍紧紧拥靠，但门额上“雄镇北门”四大字，依然穿透出虎虎英风。现在，这里已成了露天咖啡馆，极富浪漫情调，是高雄人下午和夜晚休闲的绝佳之地。你可以一边品尝“领事夫人下午茶”，一边欣赏大自然的造化旖旎，度过一段悠闲的时光。,2075,(886-07)5250100,http://www.khhuk.org.tw,2-3小时,捷运 ： 1、搭乘捷运橘线至【西子湾】下车，沿着哨船街步行街莲海路步行可达。  2、搭乘捷运橘线至【西子湾】2号出口，转搭橘1、市公交99路公交至【西子湾站】下车可达。   火车： 1、搭高铁至【左营】站下，转搭高铁鼓渡专车至【港务局】站下。   2、搭台铁至【高雄】站下，转搭248路公交车至【中山大学站（隧道口）】下，沿着哨船街步行街莲海路步行可达。 公车 搭乘哈玛星文化公交（每周一休息）、99路在【英国领事馆】站下车。,成人票新台币99元；优待票新台币49元（满20人以上之团体）；优惠票新台币39元（6岁以下儿童，65岁以上长者）。,周一至周日9:00-21:00（20:30 停止售票，截止入场）  每个月第三周的星期一休馆，惟暑假期间（每年7、8月）为因应旅游旺季提供相关服务，爰不休馆；国定假日除农历除夕休馆一日，其余照常开放。  若遇高雄市停止上班，则休馆。,高雄市鼓山区莲海路20号,
40501171,/poi/961.html,961,高雄六合夜市,1,是高雄最有名的夜市，夜市高雄最坑人的夜市，因为有很多旅行团去，所以价格很高，本地人都不去的地方,2014-11-06 16:26:02,,,,,,,,,,
40501171,/poi/1529.html,1529,侵华日军南京大屠杀遇难同胞纪念馆,5,庄严肃穆庄严肃穆庄严肃穆庄严肃穆庄严肃穆庄严肃穆庄严肃穆庄严肃穆庄严肃穆,2014-04-12 16:28:44,来南京，有一个地方不能不去——侵华日军南京大屠杀遇难同胞纪念馆，正如我们不能忘记“1937.12.13——1938.1”这个时间一样。 当灰白色的建筑色调映入眼帘时，气势恢宏，庄严肃穆，也是这个城市永远避不开的痛。 整个展馆分为外景展区、遗骨陈列、史料陈列三个部分。从史料、文物、建筑、雕塑、影视等多种手法，无论是农家屋、慰安所，密密地刻着300000多个遇难者的名字“哭墙”，摆放各种沉重资料的书架，还有每隔12秒一滴水落下所意味的一个人死去的“12秒”。万人坑再现南京大屠杀的悲惨历史，揭露日本军国主义者的血腥暴行。,3698,025-86612230,http://www.nj1937.org,1-2小时,南京大屠杀坐落于建邺区水西门大街，可乘地铁或者公交到达    1、乘坐地铁2号线(油坊桥方向)， 在云锦路站下车(2号口出) 。   2、乘坐7、37、61、63路公交车，在茶南（大屠杀纪念馆）站 下车 。,免费,周二-周日8:30-16:30，每周一闭馆（如遇法定节假日则正常开放）。,南京市建邺区水西门大街418号,
40501171,/poi/1548.html,1548,月沼湖,4,被称为牛的肺，是宏村最经典的景观之一，有很多电影都在这里取景。,2015-01-02 15:19:28,月沼湖位于宏村村落中央，即牛胃处，状如半月。老百姓俗称其为月塘，建于明永乐年间（公元1403-1424年）。 月沼湖常年碧绿，塘面水平如镜，塘沼四周青石铺展，粉墙青瓦整齐有序分列四旁，蓝天白云跌落水中，老人在聊天，妇女在浣纱洗帕，顽童在嬉戏。不少经典大片都出自于此。当夜色朦胧时，月沼边一排灯笼亮起，也秒杀了无数镜头。,1416,,,30分钟-1小时,宏村内，步行可达,宏村门票内已含,全天,安徽省歙县宏村村落中央,
40501171,/poi/2651.html,2651,遇龙河,5,早上开始漂流人还不是很多，很安静，河水很清澈，推荐要去的都应该早上去。,2014-11-06 16:43:05,遇龙河长约16km，常年水质清澈，水流缓缓。相比“大家闺秀”的漓江，遇龙河则是“小家碧玉”，是最美的漂流线路之一，有小漓江的美称。 与漓江竹筏漂流的不同在于，这儿全靠人工手撑竹筏漂流，一条筏上只能坐2 人。河上还有当地人为过河而筑的28 个堤坝，也为漂流增添了乐趣。 主要景点有：犀牛塘、五指山、朝阳寨、仙桂桥、遇龙桥、归义古城遗址、汉墓群、东晕岩、八仙过海等近20 处。 最好清早起漂，游人较少，山水清晰地倒影在江面上，更能感受这份宁静。站在明代的富里桥上，是拍摄漓江之美的最佳位置。,6681,,,半程约3 小时,1、从阳朔西街到朝阳码头约30-40 分钟 （1）骑自行车：可从阳朔河畔度假酒店附近的小路进去，也可从骥马骑行过去；从阳朔沿遇龙河逆流而上，至遇龙桥，约1小时（自行车由竹筏工帮拉到下筏处），租自行车根据车的状况价格为10、20、30元不等； （2）乘班车：在阳朔汽车站乘至金宝的中巴车，每15分钟/ 班，在金龙桥下车即可看到码头，约6元/人；或在阳朔汽车站乘至桂林的班车，中途在白沙镇下车，票价2元/人，在白沙镇转乘三轮车到遇龙桥，约2元/人； （3）乘摩托车：从街到遇龙桥，约15元/人； （4）包车：从西街到金龙桥，出租车约60元   2、从工农桥码头返回阳朔 （1）租自行车骑回阳朔，约20-30 分钟，可沿途观赏十里画廊风景； （2）乘从高田开往阳朔的车，若不堵车，约10 分钟，可观赏十里画廊风景； （3）走路回阳朔，时程约1 小时，可观赏十里画廊风景。,参考上述各漂流段信息；夏棠码头及水厄底码头为休闲漂流。,8:00-18:00（一般可与所订筏工约定时间，天黑后筏工不再出筏）,桂林市阳朔县朝阳码头/ 金龙桥/ 夏棠码头/ 水厄底码头,
40501171,/poi/2671.html,2671,回民街,4,小吃一条街，里面大部分都是这一块的特色，物美价廉！！！！！！！,2014-04-12 16:39:26,,,,,,,,,,
40501171,/poi/2722.html,2722,大唐芙蓉园,4,里面每天的表演很多，做得很气派，时间充裕可以参观！！！！！！,2014-04-12 16:39:59,大唐芙蓉园是西北地区最大的文化主题公园，建于原唐代芙蓉园遗址以北，包括紫云楼、仕女馆、御宴宫、芳林苑、凤鸣九天剧院、杏园、陆羽茶社、唐市、曲江流饮等众多景点。 园内有两个“全球最大”：全球最大户外香化工程和全球最大的水幕电影表演。晚上的芙蓉园华灯齐上，更显繁华。,5618,029-85511888,http://www.tangparadise.cn/zhuanti/20120322/index.html,2-3个小时,大唐芙蓉园西门(御苑门)公交车站途径公交：21，22，23，24，44，212，224，237，526，609，715，720， 通宵4号线，游4，游9路； 大唐芙蓉园南门公交车站途径公交：21，22，23，24，212，237，307，601，609，715，720，通宵4号线，游4，游8路,旺季全价120元/人，学生票60元/人，淡季票价为90元,9:00-22:00（清园21:30） 冬季9:00-21:30（清园20:30）,西安市曲江新区芙蓉西路99号,
40501171,/poi/3461.html,3461,玄武湖公园,3,又是一城中湖，看了太多这样的湖，已成过敏状态。。。。。。。。,2014-04-12 16:27:52,玄武湖公园是江南最大的城内公园。巍峨的明城墙、秀美的九华山、古色古香的鸡鸣寺环抱其右。分作五洲，洲洲堤桥相通，浑然一体。各岛之间有桥或堤相通。 环洲，碧波拍浪。细柳依依，微风拂来，宛如烟云舒卷，故有“环洲烟柳”之称。樱洲，四面环水的洲中洲。洲上遍植樱花，早春花开，繁花似锦，人称“樱洲花海”。梁洲，风景最胜的一洲。一年一度的菊展，传统而壮观，故有“梁洲秋菊”的美誉。菱洲，洲东濒临钟山，有“千云非一状”的钟山云霞，故有“菱洲山岚”的美名。翠洲，风光幽静，别具一格。长堤卧波 ，绿带燎绕。苍松、翠柏、嫩柳、淡竹，构成“翠洲云树”特色。,3547,025-83614286;025-83612509,http://www.xuanwuhu.net/,3-6小时,公共交通    地铁：1号线玄武门站。 公交车玄武门入口： 游1、1、3、8、15、22、25、28、30、33、35、38、47、52、56、74路或地铁1号线到玄武湖公园站下即可。  解放门入口：游1、2、3、11、15、20、24、31、48、52、70、140路到鸡鸣寺，304路到台城站。   太平门入口：游3、2、11、20、24、40、44、48、58、59、68、70、93、140路或南金线到太平门站。    翠洲门入口： 游3、2、10、17、22、24、28、36、40、45、50、58、59、66、69、71、73、74、93、97、136、159、311到花木公司站或新庄站。,免费开放，机动车及自行车不得入内；景区游览车五洲线12元/站，全程30元，西南湖全程20元。   租船：脚踏小船25元/小时，脚踏大船35元/小时，电动船50元/小时。电动摇橹船（大概做8个人）20元/位，豪华画舫船30元/位（大概座20个人）。需交50元押金。,6:00-18:00，双休日闭园时间为20:00。环湖路24小时开放。,南京市玄武区玄武巷1号,
40501171,/poi/3498.html,3498,天安门广场,5,每个国家领导人都上过的地方，能不上吗？？？？？？？？？？？？？？,2014-04-12 16:54:14,在长安街南侧，北京城的传统中轴线上，座落着世界上最大的广场——天安门广场，广场中心为人民英雄纪念碑，继续向南穿过毛主席纪念堂就到了正阳门，也就是人们常说的前门。广场的西侧是人民大会堂，东侧是国家博物馆。在广场的对面，长安街的北侧即是天安门城楼，城楼下是波光粼粼的金水河。每天的清晨和傍晚，天安门广场都会举行隆重严肃的升降旗仪式，对于初到北京的人来说，观看一场升降旗仪式是必不可少的一件事。,6252,010-63095745,,半天,"1.公交 到达天安门广场东：2路, 5路, 22路, 120路, 126路, 203路夜班车, 210路夜班车, 专1路, 专2路 到达天安门广场西：2路, 5路, 120路, 126路, 210路夜班车, 专1路, 专2路 2.地铁 地铁1号线天安门东、天安门西站下车",登天安门城楼15元/人，学生等5元/人，70岁以上老年人5元/人，现役军人等免费。,天安门城楼开放时间： 淡季（11月-次年2月）：8:30-16:30，16:00停止售票 旺季（3月-10月）：8:30-17:00，16:30停止售票 天安门广场开放时间：5:00-22:00,北京市东城区长安街北侧（天安门和正阳门之间）,毛主席纪念堂
40501171,/poi/3503.html,3503,天坛,4,皇帝祈祷的地方，咋像西方教堂，皇帝向上天乞讨！！！！！！！！,2014-04-12 16:56:43,天坛位于北京城南端，是明清两代皇帝祭祀天地之神和祈祷五谷丰收的地方。天坛包括圜丘和祈谷二坛，围墙分内外两层，呈回字形。北围墙为弧圆形，南围墙与东西墙成直角相交，为方形。这种南方北圆，通称“天地墙”，象征古代“天圆地方”之说。外坛墙东、南、北三面均没有门，只有西边修两座大门——圜丘坛门和祈谷坛门（也称天坛门）。而内坛墙四周则有东、南、西、北四座天门。内坛建有祭坛和斋宫，并有一道东西横墙，南为圜丘坛，北为祈谷坛。,5970,010-67028866,http://www.tiantanpark.com/cn/,半天或一天,1.公交 天坛南门：36、120、122路。 天坛西门：2、20，120路。 天坛北门：6、34、35、36、106、111路。 天坛东门：6、25、34、35、36、39、41、43、60、610、684、685、723、814路。  2.地铁 地铁5号线-天坛东门站。,旺季（4月~10月）：门票15元，联票（含门票、祈年殿、圜丘、回音壁）34元。 淡季（11月~次年3月）：门票10元，联票（含门票、祈年殿、圜丘、回音壁）28元。 景点联票（含祈年殿、圜丘、回音壁）：20元，神乐署门票：10元。,一、四大门：  开门时间：旺季6:00，淡季6:30 ；止售时间：20:00；静园时间：21:00； 关门时间：22:00  二、景点每日8:00点开放：  旺季关门时间：17:30（大门16:00点止售联票）   淡季关门时间：17:00（大门15:30分止售联票）   三、旺季为4月1日-10月31日  四、淡季为11月1日-次年3月31日,北京市东城区天坛东里2号,天坛斋宫|天坛公园祈年门|天坛公园圜丘|天坛公园皇穹宇|祈年殿|回音壁
40501171,/poi/3512.html,3512,王府井小吃街,3,印象最深的是活的蝎子，现在还在吗？？？？？？？？？？？？？？？？？？？,2014-04-12 17:00:04,,,,,,,,,,
40501171,/poi/3519.html,3519,八达岭长城Badaling Great Wall,5,就冲每天站在上面的人这么多还没塌，就应强烈推荐，体现了古代工人的伟大！,2014-04-12 16:55:27,八达岭长城是明长城中保存最好的一段，也是最具代表性的一段，是长城重要关口居庸关的前哨，海拔高达1015米，地势险要，城关坚固，历来是兵家必争之地。登上八达岭长城，极目远望，山峦起伏，雄沉刚劲的北方山势绵延不绝。八达岭长城因山势而雄伟，山势因长城更加险峻。“不到长城非好汉”，八达岭长城是古今中外各界人士到北京游览的必到之所，迄今为止，已有包括尼克松、撒切尔夫人等在内的三百多位世界知名人士曾登上八达岭长城一览这里的山河秀色。,6458,010-69121383;010-69121226,http://www.badaling.cn,3-4小时,1.汽车 汽车至景区  919路公交车：延庆八方达电话  69143266 德胜门——延庆  早上6:00发车   末班车   19:00 延庆——德胜门  早上5:00发车   末班车   18:30 2.火车 S2线动车组  票价6元（一站5元，两站以上6元）   北京北站电话：51866223  八达岭火车站电话：51832152,淡季（11-次年3月）35元/人，旺季（4-10月）40元/人，学生及老人等25元/人； 八达岭缆车：单程80元/人，往返100元/人； 长城博物馆：免费； 全周影院：40元/人。,旺季（4~10月）：06:30~19:00 淡季（11~3月）：07:00~18:00,北京市延庆县军都山关沟古道北口,
40501171,/poi/3557.html,3557,颐和园The Summer Palace,4,慈禧60大寿的地方，想想TMD都是泪啊啊啊啊啊啊啊啊！！！！,2014-04-12 16:54:44,颐和园坐落于北京西郊，是中国古典园林之首，总面积约290公顷，由万寿山和昆明湖组成。全园分3个区域：以仁寿殿为中心的政治活动区；以玉澜堂、乐寿堂为主体的帝后生活区；以万寿山和昆明湖组成的风景旅游区。全园以西山群峰为背景，加之建筑群与园内山湖形势融为一体，使景色变幻无穷。1998年12月2日列入《世界遗产名录》。,10303,010-62881144,http://www.summerpalace-china.com,半天,到达西宫门：乘469、539路在颐和园西门站下； 到达北宫门：乘地铁4号线北宫门站D口出，或乘303、330、331、346、375、384、563、601、608、683、696、697、718、特5、特10路在颐和园北宫门站下； 到达东宫门：乘地铁4号线西苑站C2口出，或乘209、330、331、332、346、394、601、608、626、683、690、696、718路在颐和园站下； 到达新建宫门：74、374、437、952路在颐和园新建宫门站下 。,淡季（11月1日至次年3月31日）： 公园门票20元/人，学生及老人等半价优惠10元/人，联票50元/人； 旺季（4月1日至10月31日）： 公园门票30元/人，学生及老人等半价优惠15元/人，联票60元/人。 园中园需另购票：德和园5元/人，佛香阁10元/人，文昌院20元/人，苏州街澹宁堂10元/人；联票包括公园门票和园中园门票。,旺季 （4月1日至10月31日） ： 大门开放时间： 6:30 ---18: 00 园中园开放时间： 8 :30---17 :00 静园时间为 20 : 00 淡季 （11月1日至次年3月31日）： 大门开放时间： 7 : 00---17 : 00 园中园开放时间： 9:00---16:00 静园时间为 19:00,北京市海淀区新建宫门路19号,昆明湖|文昌阁|北京颐和园石舫|谐趣园|南湖岛|清华轩|西堤|十七孔桥|千峰彩翠|颐和园秋水亭|颐和园智慧海|颐和园佛香阁|颐和园须弥灵境|颐和园长廊|多宝琉璃塔|颐和园静明园
40501171,/poi/3580.html,3580,太子湾公园,3,婚纱摄影基地，花很多，人也不少！！！！！！！！！！！！！！！！,2014-04-12 16:51:06,太子湾，一个充满浪漫情怀的公园，它是每个杭州人都必去的公园，也是每对新人拍照总是想要去的地方。如果从苏堤对面的门进去，看到的是一幅原生态的景象，再往里，就可以看到一块很大的草坪、还有充满异域风情的风车。每一个出现在你眼中的景色都能给你意外的惊喜。特别是3-5月份，这时候的公园，樱花、郁金香齐开放，格外美丽。,2111,0571-87976533;0571-87963033;0571-87963701,,1小时,太子湾公园上城区南山路，乘坐公交车即可到达   乘4、4区间、31、51、52、87、315、334、514b、514、822、西湖南线景区假日线、游2/y2、游6线/y6路等公交车在苏堤站下车可达。,免费,全天开放,杭州市上城区南山路5-1号,
40501171,/poi/3582.html,3582,雷峰夕照,3,有电梯的塔，很高端大气上档次！！！！！！！！！！！！！！！！,2014-04-12 16:50:25,雷峰塔，曾是西湖的标志性景点，由吴越国王钱弘俶因为王妃生子而建。我们之所以知道雷峰塔更多的却是因为《白蛇传》。旧时雷峰塔与北山的保俶塔，一南一北，隔湖相对，有“雷峰如老衲，保俶如美人”之誉，西湖上亦呈现出“一湖映双塔，南北相对峙”的美景。每当夕阳西下，塔影横空，别有一番景色，故被称为“雷峰夕照”。  现在塔内唯一保存的古物，是在台基二层内，用玻璃罩着古塔残存的塔砖，还有原来遗址上出土的文物，除此之外，塔内布置都颇有现代风。,1789,0571-87982111,,1小时,K4、K808、Y1、Y3、J5、822/K822、K504、Y6、Y9、Y7、514区路净寺站下车。,40元，学生票30元，但只在7、8月售卖,每年3月15日—11月15日8:00-20:30，11月16日—次年3月14日8:00—17:30,浙江省杭州市西湖区南山路15号,雷峰塔景区
40501171,/poi/3742.html,3742,人民大会堂,4,希望还是哪天能来这里开会，看过之后更想！！！！！！！！！！！！！,2014-04-12 16:59:28,人民大会堂位于北京市中心天安门广场西侧，西长安街南侧。人民大会堂是中国全国人民代表大会开会的地方，是全国人民代表大会和全国人大常委会的办公场所。是党、国家和各人民团体举行政治活动的重要场所，也是中国国家领导人和人民群众举行政治、外交、文化活动的场所。人民大会堂坐西朝东，南北长336米，东西宽206米，高46.5米，占地面积15万平方米，建筑面积17.18万平方米。比故宫的全部建筑面积还要大。人民大会堂每年举行的全国人民代表大会、中国人民政治协商会议以及五年一届的中国共产党全国代表大会也在此召开。,774,010-66081188,,1小时,公共汽车：1、2、5、8、9、10、17、20、22、37、44、48、52、59、66、67、69、71、82、90、99、120、126、201、203、205、209、210、212、301、337、608、626、646、673、690、692、723、728、729、901快、特2、特4、特7、特11、专1线、专2线、快速公交1号线。  地铁：地铁1号线天安门西站、地铁2号线前门站,成人30元，学生15元。,1月、2月、3月、12月：9：00至14：00 4月、5月、6月： 8：15至15：00 7月、8月： 　7：30至16：00 9月、10月、11月: 8：30至15：00,西城区西长安街天安门广场西侧,
