uid,poi_href,poi_id,name,star,content,datetime,description,pics,tel,site,time,traffic,ticket,opentime,location,insides17122970,/poi/520.html,520,香港迪士尼乐园Hong Kong Disneyland,5,真的是梦幻的旅程，从坐上迪士尼专线开始一直到晚上夜幕降临，太好玩！,2014-10-21 22:28:31,香港迪士尼乐园（Hong Kong Disneyland）位于大屿山，环抱山峦，与南中国海遥遥相望，是一座融合了美国加州迪士尼乐园及其他迪士尼乐园特色于一体的主题公园。 香港迪士尼乐园包括七大主题区：幻想世界、明日世界、探险世界、反斗骑兵大本营、灰熊山谷、美国小镇、迷离庄园。唐老鸭会在3D的米奇幻想曲出现；米奇、米妮和高飞，更会随时现身在梦想花园与您近距离会面。如果想一次与众多迪士尼朋友见面，记得留意场面盛大的迪士尼飞天巡游；还有一定要欣赏载歌载舞的百老汇歌舞剧米奇金奖音乐剧，到了晚上，璀璨的星梦奇缘烟花表演一定不能错过。,33535,(852)35503880,http://www.hongkongdisneyland.com.cn,1-2天,"（1）可乘快捷方便的地下铁路，在欣澳站转乘迪士尼线到迪士尼站。 （2）由香港国际机场（机场站）到青衣站再转乘东涌线前往欣澳站。欣澳站与迪士尼站的列车服务时间：由欣澳站开出 6：15-00：45；由迪士尼站开出6：20-00：40，班次：4至 10分钟一班  （3）乘坐巴士R33、 R42 巴士来回香港迪士尼乐园及香港市区；往机场/东涌或亚洲国际博览馆的巴士（即""A""及""E""线巴士），于青屿干线收费广场转乘路线第R8前往香港迪士尼乐园；选乘跨境巴士服务，经皇岗往返香港迪士尼乐园及中国内地。  ①深圳到迪士尼可乘地铁，如果从罗湖口岸出发，线路为：罗湖→九龙塘→太子→荔景→欣澳→迪士尼→火车地铁，不必出闸而转车。全程77分钟，车费51港币，如果使用地铁通45港币。 ②珠海到迪士尼珠海九洲港坐船到香港，可以有三个目的港，分别是位于九龙尖沙咀的中港城中国客运码头、位于港岛上环信德中心的港澳码头和位于机场的海天客运码头。这三个码头，距离迪士尼最近的是中港城，船程70分钟左右。到了中港城，沿广东道往北走10分钟内就到西铁柯士甸站。乘坐西铁一站到南昌站，转东涌线三站到欣澳站，再转一程迪士尼专线就到了。车程大约30分钟，单程票价19港币，刷八达通则为17港币。 ③香港机场到迪士尼17.8公里公交线路：s1路下行→地铁东涌线→r33路上行，全程约17.8公里  <1>从香港国际机场步行约380米，到达港龙及中航大厦站 <2>乘坐s1路下行，经过3站，到达东涌地铁站  <3>步行约200米，到达东涌地铁站 <4>乘坐地铁东涌线，经过1站，到达欣澳站 <5>步行约640米，到达青屿干线收费广场站  <6>乘坐r33路上行，经过1站，到达迪士尼乐园站（也可乘坐r42路上行、r8路下行）。",一日门票：成人（12-64岁）：499港币；小童门票（3-11岁）：355港币；长者门票（65岁或以上）：100港币；普通日门票适用于有效期内的所有日期，特选日除外。 两日门票：成人（12-64岁）：680港币；小童门票（3-11岁）：480港币；长者门票（65岁或以上）：170港币（适用于七日内任意两日） 更多门票优惠请访问：https://www.hongkongdisneyland.com/zh-hk/tickets/,10：00-20：00,香港离岛大屿山,河景餐厅|香港迪士尼乐...|香港迪士尼美...
17122970,/poi/638.html,638,拙政园,4,我们应该是错高峰旅游的原因，游园的人不是很多，各种摆拍都可以有，莲花虽已败落，但园林的风韵依然存在，一年四季各有各的景色吧。用心转完整个园林2个小时是挡不住的，但是跟着讲解走2个小时足矣 苏州园林的代表，90/人的门票，很值得，门口有好多大妈说60/人，也是可以买的,,拙政园，以水见长、自然典雅、庭院错落、花木为胜。始建于明代，与留园、北京颐和园、承德避暑山庄并称为中国四大名园。拙政园里处处是精雕细琢，粉墙黛瓦，小桥流水，绿树红花，蕉肥竹瘦。 此园分东、中、西三部分，各有风味。东园面积最广，绿野遍布、莲渠萦绕，树古林深。东园与中园，以极为别致的游廊为屏风，连接彼此。立于廊下，才能细细感受古树参天、小桥流水的意趣。,10856,0512-67510286;0512-67546631,http://www.szzzy.cn/,1-2小时,"公共交通    1、乘坐40、313路北园路站     2、乘坐55、178、202、262、309、518、529、811、923、夜2路, 游1、游2、游5路苏州博物馆站",淡季（10月31日－3月31日，6月）70元，旺季（4月－5月，7-10月）90元；学生票半价；70岁以上老人、现役军人凭证、残障人士在残疾日以及1.2米以下儿童免票。8:00-16:00每隔30分钟有免费讲解，每次讲解时间不少于40分钟,3月1日到11月15日：7:30-17:30 11月16日到次年2月29日：7:30-17:00,苏州市姑苏区东北街178号,
17122970,/poi/654.html,654,朱鸿兴面馆(观前店),4,早上听本地人的话，吃了头汤面！要了一碗面巾面！感觉面像挂面~,2015-02-04 18:16:42,,,,,,,,,,
17122970,/poi/667.html,667,莎莎sasa(尖沙咀弥敦道),3,据说SASA有假货，略微失望··,2015-03-01 23:21:07,,,,,,,,,,
17122970,/poi/734.html,734,Esprit outlet(东荟城名店仓)Esprit outlet(东荟城名店仓),4,样子很全，反季节买很便宜，很实惠,2015-03-01 23:26:23,,,,,,,,,,
17122970,/poi/758.html,758,九记牛腩(上环店),5,超级好吃，味道无敌，好吃的东西很也是很多的，排队的人超级多~~,2014-10-21 22:34:50,,,,,,,,,,
17122970,/poi/760.html,760,重庆大厦,3,为了找到那家很有名的曲奇而去的地方，没有什么特别深刻的印象。,2014-10-21 22:32:14,重庆大厦是由五栋楼（分ABCDE)连在一起，里面住着来自全球100多个国家的住户和商户，常住客中以印度和巴基斯坦等南亚地区国籍的居民为多，也有一部分来自非洲，中东地区，还有一部分白人，简直就是个“小联合国”。美国《时代》杂志曾评论重庆大厦是最能反映全球化，最能反映香港多元文化特色的地方。王家卫导演的《重庆森林》也在此取景拍摄，大厦里有很多廉价的宾馆，商店，餐厅，外汇兑换店等。 10年前的重庆大厦环境和治安是很乱的，后来进行了大规模的整修和改造，大厦里装了很多摄像头，环境和治安改善了很多，成为背包客们在香港住宿的首选地。,332,,,,,,,香港九龙尖沙咀弥敦道40号,
17122970,/poi/924.html,924,泰昌饼家(中环)Tai Cheong Bakery,5,网上推荐的餐厅，人还好，比较不好找,2015-03-01 23:04:33,,,,,,,,,,
17122970,/poi/928.html,928,红砖厂创意园,4,广州的798，文艺青年聚集地。,2015-04-11 22:20:29,红砖厂创意园是广州第一家非房地产包装的真正意义创意区，是一个以国际标准定义的艺术、生活中心，现在，红专厂正以现代的视野，国际的平台，探索、打造富有时尚、创意、艺术和人文精神的新领域。红砖厂前身为广州鹰金钱食品厂，在广州有着一段辉煌的历史，其内在空间及建筑群特质，使它散发出一种独特的魅力。现在，红砖厂是广州第一家非企业、非房地产包装的真正意义上的创意区，是一个艺术、生活中心，它将创意元素渗透其中，让沉睡的建筑焕发出了新的生命力。,2519,020-85574346,http://www.redtory.com.cn,半天-1天,地铁5号线员村站B出口出到马路对面的公车站（公车站后面是一个超市）坐284、299到员村绢麻厂总站下，在总站可看见一个通往临江大道的道口，从道口往琶洲大桥方向走约500米即到红砖厂大门（南门）,免费,全天,广州市天河区员村四横路128号,
17122970,/poi/956.html,956,洱海,5,洱海很大，但是1天也是可以环海一圈的，路过的喜洲、双廊、挖色都是很美丽的地方，尤其喜欢喜洲，人还不是很多，比双廊来讲安静很多，小摩托40元每天，但是只能骑行最多50KM，大摩托70元每天可以骑行70KM甚至100KM,,洱海古称“叶榆水”，也叫“西洱河”、“昆弥川”，是由西洱河塌陷形成的高原湖泊，外形如同耳朵，空中俯瞰，洱海宛如一轮新月，静静地依卧在苍山和大理坝子之间。洱海共有三岛、四洲、五湖、九曲，湖水清澈见底，自古以来一直被称作“群山间的无瑕美玉”。在洱海最南端的团山有一座洱海公园，是观赏苍山洱海景色的好处所。,16596,0872-2325080,,半天,从古城去洱海步行即可到；乘11路公交车在龙山市场站下车可达；打的或乘马车（事先与车主谈好价钱，私人巴士1元/人，马车可坐10人左右，约4元/人）；下关到洱海码头，可乘6路车或的士,洱海公园免费 南诏风情岛50元/人，玉叽岛12.5元/人，严家民居62元/人，严家大院20元/人；洱海游船142元/人（含南诏风情岛、天镜阁、小普陀、金梭岛等）,全天,云南省大理市下关洱河南路1号,
17122970,/poi/979.html,979,花园街/波鞋街,3,跟想象差很多，鞋子乱七八糟，不知是真是假？？？,2015-03-01 23:30:31,,,,,,,,,,
17122970,/poi/985.html,985,I.T. OUTLETI.T. OUTLET,4,人很多，可能是国内没有店面吧。,2015-03-01 23:26:49,,,,,,,,,,
17122970,/poi/1034.html,1034,锦江之星（太原五一广场店）,3,交通一般般，门口的街道很不是很繁华，酒店背后有个停车场，但是不大,2015-01-15 18:11:05,,,,,,,,,,
17122970,/poi/1038.html,1038,平遥天元奎客栈Pingyao Tianyuankui Hotel,4,酒店很有特色，就在主街道上，吃的饭也很有名！很不错的青旅外加民宿,2015-02-04 18:44:22,,,,,,,,,,
17122970,/poi/1058.html,1058,香港半岛酒店The Peninsula Hong Kong,5,环境好，设施好，服务好，价钱好,2015-03-01 23:10:11,,,,,,,,,,
17122970,/poi/1060.html,1060,满记甜品(天汇城店),3,全国一瞬间开满的满记都是一个味道,2015-04-11 22:16:02,,,,,,,,,,
17122970,/poi/1193.html,1193,三大炮,3,景点必须出现的小吃，成都很有名小吃之一，个人呢不是很喜欢~~,2015-02-04 18:52:17,,,,,,,,,,
17122970,/poi/1204.html,1204,龙抄手(春熙路店),4,人很多，去晚了要等位，人均20左右，红油龙抄手必须吃！分店很多,2015-02-04 18:51:46,,,,,,,,,,
17122970,/poi/1204.html,1204,龙抄手(春熙路店),3,"很有名的龙抄手 逛春熙路的时候 很容易就找到了 大大的招牌 去的时候不是饭点 也坐满了人 找好位置再去点餐哦 因为点餐的时候会问桌牌好 会有人送到桌上 小吃价格都不算贵 一顿......",2015-07-02 21:13:03,,,,,,,,,,
17122970,/poi/1288.html,1288,三亚维景国际度假酒店Grand Metropark Resort Sanya,5,酒店真心很好！尤其晚上特别的美丽！整体环境也很好~没的说的五星级,2015-02-04 21:20:29,,,,,,,,,,
17122970,/poi/1400.html,1400,白普理赛马会青年旅舍(大美督),4,网上有人推荐，除了交通不方便，其他评价都不错,2015-03-01 23:32:01,,,,,,,,,,
17122970,/poi/1514.html,1514,夫子庙美食街,4,外地游客首选地区，美食小吃一条街，不过味道不要强求。推荐莲湖糕点的红豆圆子，红豆汤汁做的特别细腻！,2015-06-09 12:25:38,,,,,,,,,,
17122970,/poi/1526.html,1526,夫子庙,5,夫子庙的风光主要在于美食街和秦淮河畔风光的欣赏，建议下午去先吃小吃，等天黑了再去游秦淮河。,2015-06-09 12:38:34,南京夫子庙即孔庙，始建于宋景祐元年（公元1034年），由东晋学宫扩建而成，夫子庙建筑群主要由孔庙、学宫、江南贡院荟萃而成，是秦淮风光的精华。夫子庙是秦淮河畔的标志性建筑、秦淮风光的精华、南京民俗、小吃集中地，夜市也繁华，可谓最具老南京风味的地方。其中的大照壁全长110米，是全国照壁之最。夫子庙前，相对于大照壁的石栏杆为明正德年间所建，是夫子庙建筑群中唯一保存最好的古代建筑。,3180,025-52377008,http://www.njfzm.net/,2小时,地铁一号线三山街站下。1、4、7、40、44、49、62、304路到夫子庙（东）站下；游2、1、15路到夫子庙（北）站下；游4、2、14、16、23、26、33、43、46、63、81、87、101、102、103、106、305路到长乐路站下；301路到瞻园路站下。,夫子庙大成殿、江南贡院、王导谢安纪念馆、李香君故居，秦大士故居单独售票分别为30元、20元、8元、16元、8元。,夫子庙大成殿：8:00-21:30；江南贡院：8:30-22:00,南京市秦淮区中华门内秦淮河北岸(秦淮河北岸贡院街),夫子庙游船码头
17122970,/poi/1910.html,1910,雪域餐厅,4,算是比较受欢迎的一家餐厅，饭店需要排队。人均60元左右,2015-07-03 11:13:32,,,,,,,,,,
17122970,/poi/1913.html,1913,玛吉阿米,4,在八廓街东南角，非常火的一家店。口味还不错，甜茶很好喝,2015-07-03 11:39:29,,,,,,,,,,
17122970,/poi/2253.html,2253,西安书院青年旅舍Shuyuan Youth Hostel,5,离酒吧街很近，环境很好，卫生还好,2015-03-01 23:41:05,,,,,,,,,,
17122970,/poi/2305.html,2305,欢乐谷,5,WOW！对于我们这个来自大西北的孩子来说，第一次万圣节过得这么真实，白天玩了各种游戏，晚上赶上万圣节活动，美美的吓死了,2014-10-20 22:58:44,欢乐谷是中国最佳主题乐园之一，共分为西班牙广场、卡通城、冒险山、欢乐岛、金矿镇、香格里拉森林、飓风湾、阳光海岸等8大主题区，有100多个老少皆宜、丰富多彩的游乐项目。从美国、荷兰、德国等国家引入众多全国乃至亚洲独有的项目，奇趣的玛雅水公园，适合带孩子同玩，其中“矿山车”让人体验山洪大暴发时矿工逃生的惊心动魂的场面；“太空梭”将在1.8秒的瞬间，高速弹射到60米高空，再自由落体直线下坠，冒险刺激，挑战心理极限；“四维影院”依托欢乐谷的实景，打造出国内首个集声、光、电、影、特效于一体的大型水上实景，不可不看。,709,0755-26949184;0755-26949190,http://sz.happyvalley.cn/Index.asp,1天,1、乘坐深圳地铁1、2号线在世界之窗站下车，步行3分钟即至欢乐谷； 2、罗湖火车站乘坐观光巴士直达欢乐谷； 3.市内乘坐20，21，26，32，42，43，54，59，66，70，72，78路等公交车车至世界之窗站下车,全价票：230元，夜场票：100元。,日场9：00-22：00，夜场18：00-22：00（适用于2016年7月1日至8月28日）；不同季节可能略有调整，以当日景区公告为准。,深圳市南山区侨城西街1号,
68868504,/poi/7729142.html,7729142,塞罕坝白桦林,5,真的是想说好多，确没什么可说，本来是要去草原上玩玩，但是太冷啦，而且坐车坐过了，本来去机械林场或者红山军马场，结果坐车到了终点，坐到了桦木林场，漂亮，但是冷的不成，就取道赤峰，去了红山了。,2015-10-08 09:47:14,塞罕坝森林公园是林的海洋，公园内有林地面积110万亩。森林主要以落叶松、樟子松和云杉为主，还有白桦、山杨、柞树、五角枫等。其中著名的白桦林就位于塞罕塔的西边，这里有成片的的白桦树，银白色的挺拔树干、遮天蔽日的树叶，秋季时来观赏是最佳时间，金黄色的落叶与苍茫的枝干，营造出壮阔之美，是摄影爱好者们的取景基地。,183,,,,白桦林位于塞罕坝景区内，最著名的一片白桦林位于塞罕塔西边，景区内没有公共交通，建议包车或者自驾前往。,,,河北省承德市围场满族蒙古族自治县塞罕坝国家森林公园内,
68868504,/poi/6886917.html,6886917,安阳火车站AnYang Railway Station,3,火车站不大不小，人不多不少，路过而已。,2015-10-28 16:17:17,,,,,,,,,,
68868504,/poi/24310.html,24310,云冈石窟,3,也许去的不是时候，石窟周边区域漫天黄沙，尘土飞扬，然后就随便一转就回来了，照片都懒得拍了。,2015-10-08 09:49:20,云冈石窟与敦煌莫高窟、洛阳龙门石窟和麦积山石窟并称为中国四大石窟艺术宝库。云冈石窟是当时统治北中国的北魏皇室集中全国技艺和人力、物力所雕凿，是由一代代、一批批的能工巧匠创造出的一座佛国圣殿。 云冈石窟一共有20窟，其中第三窟是云冈最大的石窟，第五六窟为双窟，窟内壁画精美绝伦，四壁满雕佛龛、佛像。是云冈石窟中最有代表的石窟。第十六至二十窟，是云冈石窟最早开业凿的五个洞窟，第十八、十九、二十窟为一组，第十九窟是中心窟，开凿时间最早。第二十窟为露天造像，据传早年窟顶坍塌但是佛像丝毫未毁，高肉髻，广额丰颐，长目高鼻，有八字髭，手结禅定印，质地厚重的袒右袈裟，衣纹凸起，具有犍陀罗造像遗风。大佛挺拔健硕的身躯，气势雄浑的神情，突出表现了鲜卑游牧民族的强大，是云冈石窟雕刻艺术的代表与象征。景区内还有石窟博物馆，展出石窟残件，介绍石窟大历史。,4443,0352-3029625,http://www.yungang.org/,4-5小时,市内乘3路车在云冈石窟站下车,旺季（3月1日至11月30日）150元，淡季（12月1日至次年2月28日）120元（淡旺季价格浮动以景区公告为准）； 全日制在校学生（不包括继续教育学生及各种成人进修学员）凭有效证件购买学生票，每张60元； 1.2米以下儿童、60岁（含）以上老人现役军人、残疾人凭有效证件，新闻记者凭国家新闻出版署颁发的记者证免票； 无干扰话麦租赁：押金：300元/10人，租金：20元/10人。 参观完毕，请将无干扰话麦交给讲解服务处，押金退回； 自动导游讲解：押金：100元/人，租金：10元/人（中文），40元/人（英语）,夏季： 4月15日-10月27日 8:30-17:20； 冬季：10月28日- 4月14日 8:30-17:00； 陈列馆开放时间为4月-11月，9:30-16:30,山西省大同市城西约16公里的武周山南麓,6窟|20窟|万佛洞|大同云冈石窟...|1、2窟|3窟|5窟|7、8窟|9窟|17窟
68868504,/poi/100684.html,100684,汉庭酒店张家口宣化店Hanting Express Zhangjiakou Xuanhua,4,住着不错，性价比可以，当然主要是我可以报销，所以没想那么多。,2015-10-11 11:15:32,,,,,,,,,,
68868504,/poi/7689347.html,7689347,唐山火车站TangShan Railway Station,3,车多人杂，打个车花了180，恩，还是自己太年轻。,2015-10-12 11:05:15,,,,,,,,,,
68868504,/poi/6885384.html,6885384,闫家驴肉老店,4,恩，驴肉火烧只得去尝尝，只是莫要太多了，我在阜平吃火烧的时候是第一次吃，觉得实在是太赞了，然后吃了四五天，然后有一段时间听见驴肉火烧就像吐··········,2015-10-08 10:02:22,,,,,,,,,,
68868504,/poi/6982153.html,6982153,石家庄站shijiazhuang railway station,3,石家庄站是一个值得一去的地方，当然，这是有条件的，那就是下雨的时候，因为这个时候去，你可以看瀑布。,2015-10-09 06:57:25,,,,,,,,,,
68868504,/poi/6329611.html,6329611,丰宁京北第一草原,5,丰宁的天空，彩云绽放的天空，六月的湛蓝，也许没有在最美的时间遇到你，但是你却依旧美丽的让人神迷。,2015-10-08 09:39:11,京北草原又称丰宁坝上，位于河北省北部丰宁县西北部大滩镇，距承德市区250公里，距北京280公里，是距首都北京最近的天然草原，故名“京北第一草原”。草原面积为600平方公里，每年7、8月间气温约18度，是京北草原最美的季节，这里青草没膝，山花遍野，不仅有“天苍苍，野茫茫，风吹草低见牛羊”的迷人草原景色，而且有丰富多彩的满，蒙民族风情。,2851,0314-8280094,,1-2天,A.公共交通：乘火车至虎哈什站下车，出站后转乘前往京北第一草原的班车即可 B.自驾：从北京出发，经京顺路进入怀柔县城，看到“丰宁”路标后沿指示牌行驶约3小时，进入丰宁县城，依“京北第一草原”指示牌向北行驶50公里即到,门票：进入丰宁坝上草原无需门票 娱乐套票：180元/人，包括飞斧、射箭、流星炮车、喷火神枪、激情转马、滑草、梦幻飞碟、蒙古人家、弹跳飞人、野战博击、疯狂斗牛、英雄战城、电子篮球等草原娱乐项目,每年的5~10月是丰宁坝上的旅游旺季 10月过后，丰宁坝上的住宿、餐饮等配套设施基本都停止营业,河北省丰宁满族自治县大滩镇,
68868504,/poi/7728788.html,7728788,磐锤峰,4,夏天去过，冬天也去过，下雨的时候路过，苍翠相连的承德，一点多不像是河北的城市，风雨浸润的磬锤峰，如同天外飞来般，俯瞰漫地绿墨。,2015-10-08 09:01:35,磬锤峰位于河北省承德市市郊，山挺拨峭立的石柱 高59.42米，其上粗下细形如洗衣木捶，故康熙皇帝赐名为 ‘’磬锤峰‘’，俗称‘’棒捶山‘’。承德古时为海，后沦桑为陸地。,27,,,,,,,河北省承德市,
68868504,/poi/7691504.html,7691504,西盟龙潭（勐梭龙潭）,5,龙潭真是不错，西盟县城漂亮的很，走着就可以转完了，龙潭就在县城里，冬天去山清水秀云绵白，夏天去云拢烟绕雨朦胧。,2015-10-08 09:25:22,,,,,,,,,,
68868504,/poi/7732616.html,7732616,芒景村,5,走过，路过，总是民风淳朴好人多，风景也不错，天高云略远，树翠山蓬勃。,2015-10-08 09:10:33,,,,,,,,,,
68868504,/poi/6326810.html,6326810,张北草原,4,六月去的，据说九月更美，只是路过。但是，即便是短暂的停留，也让人难以忘怀。,2015-10-08 09:04:18,--张北草原位于张家口西北70公里的张北县境内，由中都和安固里两大草原组成，是锡林郭勒草原的一部分。 --这里还是皇家狩猎、避暑、 巡幸之地，风光秀丽、气候宜人，每年夏季，水草丰美，繁花遍地。 --游客还可以策马扬鞭，弯弓射箭，一展万丈豪情；也可以观看马术、摔跤、草原歌舞等草原传统娱乐项目。  --著名的张北草原音乐节也举办于此，每年夏天都会燃爆草原，狂躁三天三夜，已成为张北草原的另一大特色。,367,,,2天,张北草原位于河北省张家口市西北，是距离北京最近的草原，最佳交通方式是自驾，距离较远的游客也可以乘火车或者坐大巴前往。 ①自驾：张家口市出发：G207—张石高速公路—郝家营/G207出口—匝道—X453—张北坝上草原。 ②大巴+包车 大巴：北京到张北的班车乘车地为六里桥汽车站和永定门汽车站，六里桥汽车站发车时间为每天6:10、7:50、8:00、8:55、16:00、16:40，共6班。永定门汽车站发车时间为每天8:00、10:00、20:00，共3班。票价为87元-100元不等。 包车：到达张北县城后可以包车游玩，包小车一天约需400元左右。,安固里草原门票：20元/人,全天,河北省张北县县城西北70公里,
68868504,/poi/7429389.html,7429389,布哈河,5,认为雕琢痕迹非常轻，河水可以直接饮用，河流两岸高寒草甸柔软可人，非常适合去露营。特别是神山附近，可以在舟群住宿，神山上能看到来回盘旋的苍鹰，肃穆。,2015-10-08 10:26:57,布哈河（bu ha chu），亦作Buha River，即种牦牛之河的意思。发源于疏勒南山的岗格尔雪合力冰峰，其上段藏经称“夏日格河”，下段称布哈河。,51,,,,,,,青海省青海湖盆地西北部,
