uid,poi_href,poi_id,name,star,content,datetime,description,pics,tel,site,time,traffic,ticket,opentime,location,insides43479690,/poi/177.html,177,三潭印月,5,坐着小船，在西湖上畅游~~优哉游哉的来到三潭印月~只可惜没有看到映月的美景哦，呵呵,2014-02-25 14:44:29,又称“小瀛洲”，是西湖中最大的一个岛，被誉为“西湖第一胜境”，是江南水上庭院艺术的代表作。 九曲桥东，隔水与一堵白粉短墙相望。墙两端了无衔接，形若屏风。但粉墙上开启四只花饰精美的漏窗，墙内墙外空间隔而不断，相互渗透。全岛花木疏密相间，以翠柳，荷花，红枫，木芙蓉为主，四季花开不断，艳丽多彩。 三潭印月还从岛上向湖上延伸。三座瓶形小石塔鼎足而立，一元纸币上的图案就是它了。环塔身分布五个小圆孔，中秋前后去看看，那时可以看到33个月亮，这时水天相映，塔中点燃灯烛，与明月上下争辉。赏月游湖者摇浆前来，搅动满湖银辉，天月，水月，塔月，心中之月，有“月光映潭，塔分为三”之说。,1495,,,1小时20分钟,上岛游玩需要乘游船，分为豪华画舫（有空调）和普通游船两种，游玩结束后可凭票乘船返回至花港、湖滨、中山、岳庙码头其中任意一个码头,55元/人，船票中已包括了游小瀛洲的门票，包来回,景区全天开放，电动船开行时间为：春夏季7:30-16:30，秋冬季8:00-16:00,西湖区西湖中部偏南,
43479690,/poi/180.html,180,南宋御街,5,南宋御姐，和河坊街很久，或者说是交叉的吧，具体的位置说明，记不住了~但是店铺很多，很好,2014-02-25 14:46:39,,,,,,,,,,
43479690,/poi/195.html,195,新丰小吃店(解放店),4,非常便宜，接地气的小吃店~~早餐的首选之地！包子，粉儿都可以,2014-02-25 14:45:24,,,,,,,,,,
43479690,/poi/198.html,198,皇饭儿(高银街总店),5,好像有点贵哦？吃到了，西湖醋鱼，叫化仔鸡，等特色吧~~环境还算可以,2014-02-25 14:45:27,,,,,,,,,,
43479690,/poi/403.html,403,马迭尔冷饮厅,4,慕名而来~~冰棍儿很好吃，呵呵，大家都排队买冰棍儿，所以对于从来不吃雪糕的人，都在大街上吃起来了，呵呵,2014-02-24 14:46:01,,,,,,,,,,
43479690,/poi/404.html,404,圣·索菲亚大教堂,3,索菲亚大教堂，太出名了~~~但是我们并没有进去，因为门票贵&人多~~,2014-02-24 14:45:40,圣索菲亚大教堂是远东地区最大的东正教堂。始建国土1907年3月，是沙俄东西伯利亚第四步兵师修建的随军教堂。后重建，直至1932年落成。它是目前中国保存最完美的典型拜占庭式建筑，这座诞生近百年的建筑宏伟壮观，古朴典雅，充溢着迷人的色彩。 教堂的墙体全部采用清水红砖，上冠巨大饱满的洋葱头穹顶，统率着四翼大小不同的帐蓬顶，形成主从式的布局。四个楼层之间有楼梯相连，前后左右有四个门出入。正门顶部为钟楼，7座铜铸制的乐钟恰好是7个音符，由训练有素的敲钟人手脚并用，敲打出抑扬顿挫的钟声。 巍峨壮美的圣索菲亚教堂，又是沙俄入侵东北的历史见证和研究哈尔滨市近代历史的重要珍迹。教堂内部现为哈尔滨市建筑艺术馆，展出了哈尔滨发展史上珍贵的照片。,8235,,,1小时,乘1、5、20、61、113、114、206路等公交车在兆麟街站下车后，步行可达,成人20元/人，儿童、学生10元/人,8:30-17:00,哈尔滨市道里区透笼街88号耂十二,
43479690,/poi/405.html,405,中央大街步行街,4,多么有名的旅游景点，妈呀，人老多了，真是人山人海呦~~没有深入逛，只是看看街上的一些有特点的店铺,2014-02-24 14:45:42,中央大街步行街始建于1898年，初称中国大街。1925年改称为沿袭至今的中央大街，现在发展成为哈尔滨市最繁华的商业街。大街北起松花江防洪纪念塔，南至经纬街，全长1450米，被誉称哈尔滨第一街，以其独特的欧式建筑，鳞次栉比的精品商厦，花团锦簇的休闲小区以及异彩纷呈的文化生活，成为哈尔滨市一道亮丽的风景线。最奇特的是中央大街上铺的石头，他是长方形条形石，但以纵向冲上铺满，还有街上71栋欧式及仿欧式的建筑颇有看点，巴洛克式、折衷主义，以及十九世纪末二十世纪初的新艺术运动建筑统统在这里体现。这些建筑是西方建筑艺术的精华，称中央大街为一条建筑的艺术长廊也不为过。,7319,,,3小时,乘53、113、114、126路公交车，在中央大街站下车,免费,全天开放,哈尔滨市道里区(北起松花江防洪纪念塔，南至经纬街),
43479690,/poi/843.html,843,南普陀寺,4,带着一颗虔诚的心，来到南普陀寺。氛围和环境都不错。而且南普陀寺不收门票，还可以免费领香火。真的挺好的~~~比那些收费的寺庙要好很多！！！,2015-08-21 13:54:51,"南普陀寺是闽南乃至全国闻名的佛教寺院。整个寺庙建筑群背依秀奇群峰，著名的闽南佛学院就坐落于此，与厦门大学仅一墙之隔，却有两种意境：""古朴与摩登并存，小和尚和大学生为邻""。南普陀寺建于明代永乐年间(1403—1424年)，明末(1628年)毁于兵火。清康熙二十三年(1684年)，靖海侯施琅将军重建。因寺院是奉观音菩萨主，又位在我国四大佛教道场之一的浙江舟山普陀山之南，故称南普陀寺。",10679,0592-2094147,http://www.nanputuo.com/,2-3小时,乘1、15、21、45、841、959路等公交车在厦大站下车可达,免费,4:00-18:30,厦门市思明区思明南路515号,闽南佛学院
43479690,/poi/1093.html,1093,杭州西湖,5,上有天堂，下有苏杭~~最美的就是西湖了~也不知道它哪里美，但是谁也替代不了,2014-02-25 14:44:25,西湖自古便是杭州之魂所在。宋代大文豪苏东坡曾写道：“天下西湖三十六，就中最好是杭州”。西湖，她拥有三面云山，一水抱城的山光水色，她以“欲把西湖比西子，浓妆淡抹总相宜”的自然风光情系天下众生。 杭州西湖的美景不仅春天独有，夏日里接天莲碧的荷花，秋夜中浸透月光的三潭，冬雪后疏影横斜的红梅，无论何时来，都会领略到她不同的风采。沿湖地带绿荫环抱，山色葱茏，画桥烟柳，云树笼纱，逶迤群山之间，林泉秀美，溪涧幽深。近百座各具特色的公园、风景点中，有三秋桂子、六桥烟柳、九里云松、十里荷花，更有著名的“西湖十景”以及近年来相继建成开放的十多处各具特色的新景点，将西湖连缀成了色彩斑斓的大花环，使其春夏秋冬各有景色，晴雨风雪各有情致。出现在人民币壹圆纸币背面的三潭印月景观，亦体现着西湖在中国风景名胜中特殊的地位。,11362,0571-87179617,http://www.hzwestlake.gov.cn/,建议0.5-1天,西湖坐落于杭州上城区，可乘坐公交车或者地铁到达   1、地铁1号线到龙翔桥站，出站步行400米步行就到西湖。   2、乘K4、游2路苏堤站下；乘28、15路玉泉站下；27路，7路岳坟站下，均可到达。,免费,开放式景区全天开放,浙江省杭州市西湖区西湖风景区,三潭印月|雷峰夕照|苏小小墓|柳浪闻莺|虎跑梦泉|花港观鱼|曲院风荷|南屏晚钟|平湖秋月|孤山|黄龙吐翠|岳墓栖霞|吴山天风|杭州少年儿童公园|龙井问茶|万松书缘|双峰插云|杨堤景行|九溪烟树|宝石流霞|白堤|云栖竹径|玉皇飞云|西湖音乐喷泉|六和听涛(六和塔)|苏堤春晓|断桥残雪|宝石山
43479690,/poi/1241.html,1241,武侯祠,4,离锦里非常近~~~但是本地人说如果对历史不感兴趣的话可以不去，所以我就没去,2014-06-17 15:41:23,成都武侯祠肇始于公元223 年修建刘备惠陵时，是中国唯一一座君臣合祀的祠庙，是最负盛名的诸葛亮、刘备及蜀汉英雄纪念地，也是全世界影响最大的三国遗迹博物馆。如果你也是“三国迷”，那么这里一定能满足你对历史的渴求，若不想被人声打扰，最好尽量在早晨刚开门时入内参观。 成都著名的锦官深处——“红墙竹影”就在这里，不要忘记拍照纪念。,5883,028-85552397;028-85535951;028-85588596,http://www.wuhouci.net.cn/,2小时,乘1、57、82、334、335 路至武侯祠站下车；乘8、21 路至武侯祠东街站下车,通票60元，学生票30元，家庭套票120元,旺季8:00-21:30（7月1日-10月7日），淡季8:00-18:30（10月8日-次年6月30日）,四川省成都市武侯区武侯祠大街231 号,
43479690,/poi/1242.html,1242,锦里,4,一个，两天去了2次的地方~~对于外地人来说，这个地方挺不错的，但是应该本地人很少去~~ 里面有各种小吃，但是走累了，找个bar坐会儿的感觉不错,2014-06-17 15:40:43,锦里是一条仿古商业街，成都人气最旺景点之一。在这里，你可以欣赏捏泥人、摆糖画的手艺，逛逛极富三国特色的店铺、皮灯影、曹营坝、筷子店等，还可以到永远人头攒动的“好吃街”品尝四川名吃，还有茶楼、咖啡馆、酒吧、客栈等随时可落座。黄昏时分，锦里会亮起灯，颇有韵味，适合拍照游玩。,14564,028-66311313;028-85511800;028-85538914,http://www.cdjinli.com/,2小时,乘1、57、82、334、335 路至武侯祠站下车；乘8、21路至武侯祠东街站下车,免费,5:00-23:00,四川省成都市武侯祠大街231 号附1 号(武侯祠东侧),
43479690,/poi/2523.html,2523,国门,4,国门，一扇大门named国门。需要门票哦，进去也没啥看的，性价比不高的景点,2014-02-24 14:30:40,满洲里国门，位于满市西部中俄边境处我方一侧的乳白色建筑。国门高30米，宽40米，1989年建成。国门庄严肃穆，在国门乳白色的门体上方嵌着“中华人民共和国”七个鲜红大字，上面悬挂的国徽闪着的金光，国际铁路在下面通过。有黑山头中俄界河、火车头广场、和平之门广场、红色旅游展厅等著名景区。,1644,0470-6229068,,2小时,1. 在满洲里市区乘坐6路公交车到国门站即可，途中经过套娃广场、俄罗斯艺术博物馆等可以一并游玩。 2. 在满洲里市区打车前往，起步费7元，约10公里。,成人票80元；65岁以上老人、1.2米以下儿童免门票，学生40元。,8:30-17:30,内蒙古自治区满洲里市西部,
43479690,/poi/2539.html,2539,额尔古纳湿地,5,根河湿地，很nice的地方。日落十分的景色更加的美丽~我喜欢这里 湿地公园门票--50元，但是好像没有票根~~~很喜欢湿地公园，很安静，呼吸着这样的空气，感觉真的特别好！ 对了，湿地公园好像有电瓶车可以到山顶，价钱忘记了，我们选择的是徒步，走的不是很远，一边看风景，一边呼吸草原空气徒步的感觉真好！,,来到额尔古纳，最不能错过的一大风景就是额尔古纳湿地(又名根河湿地)，它被称为“亚洲第一湿地”，是中国目前原状态保持最完好、面积最大的湿地，深受摄影爱好者的青睐。 景区里有开阔的灌丛草甸，一望无际。依赖湿地生存繁衍的野生动植物也极为丰富，每年在这里迁徙停留、繁殖栖息的鸟类达到2000万只。这里是世界上最重要的丹顶鹤繁殖地之一，也是世界濒危物种鸿雁的重要栖息地之一。 景区内游玩，需要登顶海拔720米的主峰，远眺湿地全景。体力较弱者可乘电瓶车，时间充裕的话建议步行登山。从游客中心的木栈道走下去，再上坡就是最高的瞭望处，可以从不同角度观赏山崖下的湿地。其中，最具代表性的景观就是形如一片叶子的湖心岛。 在山顶还能俯瞰蜿蜒流淌的根河及额尔古纳市貌，蓝色粉色屋顶的房子交错，很是好看。如果待到傍晚，落日下的湿地会给你更多惊喜。,3565,,,1-2小时（正常40-60分钟可走完木栈道）,从海拉尔出发，可先在汽车站乘客车抵达额尔古纳的拉布大林汽车站（发车时间为7:30-17:30，每隔40分钟一趟车，票价38元，车程约2-2.5小时）。下车后，出站到马路对面坐2路公交车可直达湿地公园；但公交车车次很少，如果时间紧可打车前往。从拉布大林回海拉尔的末班车为17:30。,旺季（5月16日至9月15日）门票65元/人（1.2米以下儿童及70岁以上老人凭证免票，现役军官、残疾人及65-69岁老人凭证半价）； 淡季（9月16日至5月15日）门票20元； 景区电瓶车往返15元。,8:00-17:30,内蒙古额尔古纳市拉布大林镇的西北郊（距市区3公里）,
43479690,/poi/2585.html,2585,俄罗斯套娃广场,3,套娃广场，各式各样的套娃，可以从娃娃背后看的简介~如果耐心看下去，会发现你喜欢的‘某人个人’ 我不太喜欢套娃挂广场~但是对于摄影师来说 这是个好地方！呵呵~~~ 从国门还是坐6路汽车，几站地 就到了~~挺好,,满洲里俄罗斯套娃广场是全国唯一的以俄罗斯传统工艺品——套娃为主题的旅游休闲娱乐广场，集中体现了满洲里中俄蒙三国交界地域特色和中俄蒙三国风情交融的特点。广场规划面积54万平方米，主题广场面积6万平方米，主体建筑是一个高30米的大套娃，建筑面积3200平方米，是目前世界上最大的套娃。主体套娃内部为俄式餐厅和演艺大厅。套娃外部彩绘由代表着中俄蒙三国的美丽女孩组成，主体套娃周围有8个功能性套娃、200个代表全世界不同国家和地区的小套娃和30个色彩缤纷的俄罗斯复活节彩蛋。,2049,,,2小时,1. 在满洲里市区乘坐6路公交车到国门站即可，途中经过套娃广场、俄罗斯艺术博物馆等可以一并游玩。 2. 在满洲里市区打车前往，起步费7元。,免费,全天,内蒙古自治区呼伦贝尔市满洲里西郊,
43479690,/poi/2842.html,2842,蔡林记热干面馆(户部巷店),3,户部巷的蔡林记，挺火的，但是不喜欢蔡林记家的东西，不好吃，还没有街边的小吃好吃~~,2014-02-25 11:14:37,,,,,,,,,,
43479690,/poi/3472.html,3472,什刹海,5,挺喜欢这里的，微风拂过，感觉很好，很好！以后有机会还会来吧。。,2014-02-24 14:20:14,什刹海也写作“十刹海”，四周原有十座佛寺，故有此称。随着时间发展逐渐形成西海﹑后海﹑前海，三海水道相通。自清代起就成为游乐消夏之所。三海碧波荡漾，岸边垂柳毵毵，远山秀色如黛，风光绮丽，为燕京胜景之一。今天，这里仍旧保存着十分难得的自然景观和人文胜迹交相辉映的历史风貌，宋庆龄故居、郭沫若故居、恭王府花园、广化寺、火神庙、钟鼓楼和银锭桥等古迹将什刹海点缀得美丽灿烂。 近年来，什刹海酒吧街已成为京城夜色中最热闹的地方之一。这里还聚集着众多北京风味的特色餐厅。你可以品酒泛舟，览湖光粼粼，或徜徉两岸，听杨柳婆娑，或搜寻美食，尝御膳家宴，或投宿胡同人家品着原汁的京味儿。,2888,010-66125717;010-83223344,,半天,1.公交 地安门外站——60路; 82路; 90内; 90外; 107路; 124路; 204夜班车内; 204夜班车外； 北海北门站——13路; 42路; 90内; 90外; 107路; 111路; 118路; 204夜班车内; 204夜班车外; 609路; 612路; 623路; 701路； 地安门内站——5路; 111路; 124路; 210路夜班车; 609路； 2.地铁 地铁6号线——北海北门站,免费游玩,全天,北京市西城区羊房胡同,烟袋斜街|银锭桥
43479690,/poi/3499.html,3499,烟袋斜街,4,眼袋斜街，好像街道的感觉像眼袋那样~但是我没有啥感觉，只是某傻妞喜欢,2014-02-24 14:22:30,烟袋斜街是一条具有传统文化特色的商业步行街。它东起地安门外大街，为东北西南走向，出西南口拐弯就可看到著名燕京八小景之一的“银锭观山”，全长232米。据说在斜街的东口路北曾有一家烟袋铺，门前竖着的木雕大烟袋当幌子，足有一人多高，粗如饭碗一般，金黄色的烟袋锅上还系着条红绸穗，远远就能看到，十分的醒目。此街也由此得名流传至今。 其实烟袋斜街本身就宛如一只烟袋。细长的街道好似烟袋杆儿，东头入口像烟袋嘴儿，西头入口折向南边，通往银锭桥，看上去活象烟袋锅儿。正是基于这两方面的原因，以“烟袋”命名斜街，真可谓名副其实了。 烟袋斜街是北京最古老的的一条商业街，在清朝时主要经营烟具，装裱字画和贩卖古玩玉器，是一条繁华的商业街。在人潮涌动的街道上，你时不时就会走到风格迥异的店铺面前，可能以前这些店面里面卖的就是名家字画，但是更多的是些独具特色小吃和民族气息十足的纪念品。,1113,,,2小时,公交： 乘坐5、60、107、124、635路公交车鼓楼站下车步行202米即到。 地铁： 乘坐地铁二号线鼓楼大街站下。 乘坐地铁六号线南锣鼓巷站下或北海北站下。,免费,全天开放,北京市西城区地安门外大街,
43479690,/poi/3502.html,3502,后海酒吧街(什刹海酒吧街),5,很喜欢后海酒吧街，虽然老北京人好像很少来，但是喜欢那种听着‘静静’的音乐，和朋友一起聊天的感觉,2014-02-24 14:23:22,,,,,,,,,,
43479690,/poi/3503.html,3503,天坛,4,天坛是个神奇的地方，帝王祭祀的地方，也应该是个人杰地灵的地方，门票35块钱，很值得！里面的古树很帅气,2015-09-23 14:06:01,天坛位于北京城南端，是明清两代皇帝祭祀天地之神和祈祷五谷丰收的地方。天坛包括圜丘和祈谷二坛，围墙分内外两层，呈回字形。北围墙为弧圆形，南围墙与东西墙成直角相交，为方形。这种南方北圆，通称“天地墙”，象征古代“天圆地方”之说。外坛墙东、南、北三面均没有门，只有西边修两座大门——圜丘坛门和祈谷坛门（也称天坛门）。而内坛墙四周则有东、南、西、北四座天门。内坛建有祭坛和斋宫，并有一道东西横墙，南为圜丘坛，北为祈谷坛。,5970,010-67028866,http://www.tiantanpark.com/cn/,半天或一天,1.公交 天坛南门：36、120、122路。 天坛西门：2、20，120路。 天坛北门：6、34、35、36、106、111路。 天坛东门：6、25、34、35、36、39、41、43、60、610、684、685、723、814路。  2.地铁 地铁5号线-天坛东门站。,旺季（4月~10月）：门票15元，联票（含门票、祈年殿、圜丘、回音壁）34元。 淡季（11月~次年3月）：门票10元，联票（含门票、祈年殿、圜丘、回音壁）28元。 景点联票（含祈年殿、圜丘、回音壁）：20元，神乐署门票：10元。,一、四大门：  开门时间：旺季6:00，淡季6:30 ；止售时间：20:00；静园时间：21:00； 关门时间：22:00  二、景点每日8:00点开放：  旺季关门时间：17:30（大门16:00点止售联票）   淡季关门时间：17:00（大门15:30分止售联票）   三、旺季为4月1日-10月31日  四、淡季为11月1日-次年3月31日,北京市东城区天坛东里2号,天坛斋宫|天坛公园祈年门|天坛公园圜丘|天坛公园皇穹宇|祈年殿|回音壁
43479690,/poi/3728.html,3728,杭州鼓楼景区,4,鼓楼~离河坊街很近的哦，晚上这里很热闹，有很多小吃，可以过来逛逛,2014-02-25 14:45:04,杭州清河坊以鼓楼、吴山天风为中心，依托胡庆余堂、南宋御街、杭州碑林等历史古迹和景区。 鼓楼位于杭州吴山东面，南接十五奎巷，北临大井巷，东迎中河路，西靠伍公山，是清河坊历史街区东南面的起始点。始建于五代时期的南朝，距今约1400年左右，曾经是南宋皇帝的一座宫殿“福临殿”，民间俗称鼓楼。六十年代时拆除，2003年重建，巨幅东阳木雕作品《清明上河图》、《鼓楼形胜图》安装在展示厅上方。 二楼城楼上的大鼓直径达两米，世纪平安钟被饭防御观景台上，可供游客击鼓鸣钟以助游兴，引发思古之幽情。 杭州舞宋文化艺术策划有限公司创办于2010年，总部位于河坊街繁华地带，是一家专业从事各种文化演出策划，活动演出，商务礼仪接待的文艺策划公司，并拥有专业的广告策划、营销团队。拥有包括杭州鼓楼在内的多项旅游资源并以南宋“福临殿”作为中心，辐射至灵隐、千岛景区经营业务，尽可能的还原南宋风貌路线，使游客体验“千年风景瞬间倒流”的特殊风味。 杭州的鼓楼是根据宋代画家张择端的“清明上河图”中城门的样式仿建而成，依托“福临殿”这座临时行宫，献上4D实景真人秀《梦回南宋》歌舞，通过最具专业表演能力的数百名专业演员，专业舞美设计、道具设计、灯光设计、音响调节师，倾情演绎 “瓦子献艺”、“印度风情”、“袖水雅韵”、“红瓷茶都”、“东方佛国”、“书墨逸风”、“烟雨江南”等大宋炫彩的歌舞，一切的一切都让人如同在梦中一样…… 交通 K8 —鼓楼站下车（德胜东村—凤山门 ） Y6—鼓楼下车（黄龙体育中心—凤山门） 301—鼓楼站下车（火车南站—武林小广场）,180,0571-87809951,,,,门票120人民币,,杭州市上城区清河坊鼓楼景区,
43479690,/poi/3783.html,3783,簋街,4,夜晚的这里，很喧闹。吃着小龙虾，喝着啤酒，偶尔还有‘歌手’在唱歌，这种感觉不错,2014-02-24 14:21:03,,,,,,,,,,
43479690,/poi/5774.html,5774,东湖East Lake,4,东湖，我应该到这了这个地方，但是忘记具体是哪了，反正是一个湖，只是湖好大啊~呵呵,2014-02-25 11:13:36,汉东湖风景区位于武汉市城区，景区面积73平方公里，是中国最大的城中湖。主要游览景区有磨山景区、听涛景区、落雁景区、吹笛景区（马鞍山森林公园）、东湖樱园、东湖鸟语林等。在这里可以与自然亲密地接触，可以呼吸到新鲜的空气，每天早晚都有自行车爱好者在这里骑车环湖。,2030,027-86773706,,3-4小时,公交  1、乘坐22路公交车可直达东湖风景区。  2、乘坐14、108、402、534、537、578、605、777、810路公交车可达东湖听涛景区。  3、乘坐401、402、413、515、643路公交车可达东湖磨山景区。   出租车  武汉有两种出租车，一种是富康和爱丽舍车型，起步价6元/2公里，8元/3公里，之后1.4元/km；另一种是新款东风雪铁龙凯旋车型，起步价8元/2公里，之后1.6元/km。另加收2元燃油附加费。,听涛景区免费，磨山风景区60元，落雁景区13元，马鞍山森林公园旺季20元，淡季10元（每年3月11日至6月10日、9月11日至12月10日为旺季）； 磨山索道（单/双）：15/25元,东湖风景区内各景点开放时间略有不同。   听涛景区：8:00-17:00；磨山景区：7:30-17:00；落雁景区：8:30-17:00  湖北省博物馆：9:00-17:00（15:30停止入馆，每周一闭馆）  马鞍山森林公园：8:00-17:00（冬季）、8:00-17:30（春、夏、秋季）,湖北省武汉市武昌区沿湖大道附近,
43479690,/poi/5803.html,5803,武汉长江大桥,4,武汉长江大桥，多美宏伟壮阔呦~呵呵，溜达了一半，然后坐电梯下来，这好看到江边有人游泳，江水稍微有点混撒~,2014-02-25 11:13:30,武汉长江大桥古香古色，一年四季，春夏秋冬景色各有千秋，春天凉爽，江风宜人；夏季气候炎热，傍晚伫立桥头凝望海天交接，心情疏爽；秋季硕果时节，看无限夕阳；冬季，要是有偶尔的小雪，站在桥头，感觉世界分外妖娆。 武汉长江大桥是新中国成立之后在长江上修建的第一座大桥，其正桥八墩九孔，每孔跨度达到128m。正桥钢梁由平弦菱形连续梁组成，钢梁设计三联，每联三孔。50年来，历经风雨沧桑的武汉长江大桥，巍然立在大江之上，肩负着每分钟60多辆汽车、每6分钟一列火车通过的荷载，经受了无数次洪水、大风的洗礼，更承受了76次碰撞事故的考验。专家最近检测得出的结论是：大桥的桥墩、钢梁等主体结构可使用100年以上。 自1955年建成以来，就经历过2001年一次比较大型的翻修，在武汉的众多桥梁之中，它是最可靠，维修最少的桥梁。,2480,,,1小时,公交  乘坐11、 18、 25、 43、 514、 539、 542、 554、 566、 572、 573、 578、 607、 717、 804、 916路公交车至【临江大道平湖门】站下车即到。   自驾  从武汉站自驾车前往，全程约19公里。   步行  从黄鹤楼沿黄鹤楼南路步行至大桥，全程约800米。,免费参观 大桥桥头堡内有电梯，2元/人/次,全天,武汉市武昌区临江大道与滨江大道之间,
