uid,poi_href,poi_id,name,star,content,datetime,description,pics,tel,site,time,traffic,ticket,opentime,location,insides5670984,/poi/829.html,829,鼓浪屿,5,去那里感觉挺一般的，人多，而且那里都有这个文青的场所，可取可不去,2013-11-26 16:09:14,鼓浪屿位于厦门岛西南隅，面积1.87平方公里，常住人口约1.6万人，隔500米宽的鹭江与厦门岛相望。鼓浪屿周边海域为厦门港主要部分，登高远眺，鼓浪屿全景及周边美景尽收眼底，素有“不游鼓浪屿，枉费厦门行”之说。随着厦门经济特区的腾飞，鼓浪屿各种旅游配套服务设施日臻完善，成为集观光、度假、休闲、娱乐、购物为一体的综合性著名风景旅游区。,30191,0592-2060777;0592-2571226,,半天至一天,1、东渡码头（国际邮轮中心厦鼓码头）→鼓浪屿三丘田码头 每20分钟一班船，往返船票35元/人；发船时间冬季（10.1-次年5.31）7:10-17:30，夏季（6.0-9.30）7:10-18:30。 2、东渡码头（国际邮轮中心厦鼓码头）→鼓浪屿内厝澳码头 每20分钟一班船，往返船票：普通游船35元/人，豪华游船50元/人；发船时间同1。 3、夜间航线 厦门轮渡码头→鼓浪屿三丘田码头，每30分钟一班船，往返船票35元/人；发船时间冬季（10.1-次年5.31）17:50-23:45，夏季（6.0-9.30）18:50-23:45。 4、通宵航班 厦门轮渡码头→鼓浪屿三丘田码头，每1小时一班船，往返船票35元/人；发船时间00:15-6:30。 Tips： 可在厦门轮渡公司的订票官方网站预订：http://www.xmferry.com/，然后凭购买时使用的二代身份证即可入闸乘船；也可在“厦门市轮渡公司”的微信平台上购票。购票前请在官网上查询好时刻表。,上岛船票：外地游客35元，从东渡上岛（晚上五点半后可从轮渡上岛）；本地游客凭身份证、暂住证、医保卡等有效证伯仍从轮渡上岛，票价8元。 景区核心景点票务信息：日光岩：60元/人；菽庄花园（含钢琴博物馆）：30元/人；皓月园：15元/人；风琴博物馆：20元/人；国际刻字馆：10元/人。鼓浪屿核心景点套票（以上五景点联票）：100元/人。,鼓浪屿位于厦门岛西南隅，与厦门市隔海相望，只隔一条宽600米的鹭江，轮渡5分钟可达。 外地游客可以先乘坐飞机、火车或是汽车到达厦门，然后换乘公交或是出租车到达轮渡码头，再坐从这里驶出的渡船就能到达美丽的鼓浪屿了。 全天,福建省厦门市思明区鼓浪屿区,
5670984,/poi/843.html,843,南普陀寺,4,看到很多南方人虔诚的跪拜，我没有随喜，但是心是宁静的，好吗？,2013-11-26 16:10:06,"南普陀寺是闽南乃至全国闻名的佛教寺院。整个寺庙建筑群背依秀奇群峰，著名的闽南佛学院就坐落于此，与厦门大学仅一墙之隔，却有两种意境：""古朴与摩登并存，小和尚和大学生为邻""。南普陀寺建于明代永乐年间(1403—1424年)，明末(1628年)毁于兵火。清康熙二十三年(1684年)，靖海侯施琅将军重建。因寺院是奉观音菩萨主，又位在我国四大佛教道场之一的浙江舟山普陀山之南，故称南普陀寺。",10679,0592-2094147,http://www.nanputuo.com/,2-3小时,乘1、15、21、45、841、959路等公交车在厦大站下车可达,免费,4:00-18:30,厦门市思明区思明南路515号,闽南佛学院
5670984,/poi/823.html,823,厦门大学,3,下辈子一定好好学习，这辈子没机会来，大学真是太好啦，谁能上都是上辈子积德了,2013-11-26 16:11:47,厦门大学坐落在厦门市思明区思明南路，是由著名爱国华侨领袖、被毛泽东同志誉为“华侨旗帜、民族光辉”的陈嘉庚先生于1921年创办的，是中国近代教育史上第一所华侨创办的大学。著名校友有余光中、林峰、易中天、鲁迅等人。由于紧邻南普陀寺，学生和僧人的学习及生活场景构成了厦大校园及其附近区域独特的风景。厦门大学被喻为“中国最美丽的校园之一”，中西结合的独特建筑风格是最大看点。,24817,0592-2186110;0592-2187316,http://www.xmu.edu.cn/,3小时,乘坐1路、15路、21路、45路、751路、841路、959路在【厦大】站下车。向东南方向出发，沿思明南路走80米，即可到达厦大大南校门。费用：由岛内前往，全程1元；由岛外前往，全程2元,免费,周一到周五，厦大思明校区每天开放两个时段给游客入校参观，分别是:12:00-14:00；17:00-24:00，其中在12:00-14:00，两个校门入校游客限额1000人（大南门700人，群贤门300人）。双休日、节假日、寒暑假，正常对外开放。,厦门市思明区思明南路422号,厦门大学情人谷|芙蓉隧道|颂恩楼|建南大礼堂|厦门大学人类...|厦门大学芙蓉湖
5670984,/poi/5057.html,5057,环岛路,4,我们那次去台风恨大，没有骑双人自行车，遗憾，但是我们在海边真的感觉很好,2013-11-26 16:12:54,环岛路是厦门国际马拉松比赛的主赛道，被誉为世界最美的马拉松赛道。绕着环岛路骑自行车，聆听海浪，轻拂海风，真的是一种享受。环岛路的东南段有环岛木栈道，使之前很多游人无法到达的海边礁石地段都可以通过木栈道一览美景；另外，木栈道沿线还将设置音乐酒吧、观景亭、LED夜景等景观工程，开拓游人视野，使木栈道成为环岛路的一道新景。附近的椰风寨和胡里山炮台都是不错的去处。,5708,0592-5318858,,4小时,公交——29路公交是沿着环岛路行驶的，可以乘坐29路抵达环岛路上的各个地点,免费,全天开放,福建省厦门市思明区,
5670984,/poi/5230.html,5230,芙蓉隧道,4,都是学生做的漫画。很有特色，适合拍照，很好看，但就是有点审美疲劳,2013-11-26 16:13:42,芙蓉隧道位于厦大内部，芙蓉餐厅旁，是中国最文艺、最长的涂鸦隧道，也是厦门大学主要景点之一。该隧道于2005年开始施工，西起厦大校区芙蓉园学生食堂，沿途穿越狮山，东至厦大学生公寓门口，全长1.01公里，主要供行人及非机动车辆通行。建成之后，隧道内逐渐多了很多涂鸦，这些漂亮的涂鸦是厦大学子一笔一笔描绘而成。,11864,,,1小时,公交——乘坐1路、15路、21路、45路、751路、841路、959路在厦大站下车。,免费,周一至周五：12:00-14:00及17:30-24:00，其余时间不接待游客(双休日、节假日、寒暑假正常开放),厦门市思明区思明南路厦门大学旁,
5670984,/poi/28418.html,28418,平遥古城墙,5,感觉很好，我们去的那次大爷讲那些都是10多年前才挖出来的，好友历史的感觉啊,2013-11-26 16:15:30,平遥城墙位于山西省中部的平遥县，是中国现存最完好的四座古城墙之一。 城墙为方形，总长度为6157m，高约10m，城墙内外由泥土与砖石堆砌。城墙上可并行两辆马车，墙顶上还设有望孔、射孔、垛口等御敌设施。城墙周围原本还有护城河，为保护百姓发挥了不小的作用。 赏古城墙最佳方式，是徒步或骑行绕城游一圈，或爬上城墙（全程6千米，下城墙的地方距离不是很近，随便一走就是一两个小时），抚摸岁月拂过的痕迹，在静默中瞻仰其雄伟风姿。,1072,,,2-3小时,景点位于平遥古城内，需先到达古城内，再步行前往： 古城不算太大，可以步行游玩。城内有不少拉客的电瓶车，10-30元不等，有老人小孩可考虑坐车； 此外，也可以租辆自行车，在古城及周边转转，别有一番风味，费用大约10元半天,包含在平遥古城门票内,8:00-19:30,山西省晋中市平遥县古城,
5670984,/poi/34653.html,34653,明清一条街,3,街道晚上逛很有特色，我们沿路走了一圈，有点晕乎，但是已经明显商业化了,2013-11-26 16:16:14,平遥古城中轴线上，这里集中完整地保存着明清时期的店铺遗迹，是古城最重要、最繁华的商业街区之一，鲜明地折射出古城文化的光彩。在这条400余米长的古街上，紧密连缀着78处古店铺，包括票号、钱庄、当铺、药铺、肉铺、烟店、杂货铺、绸缎庄等等，几乎包容了当时商业的所有行当。,406,,,1-2小时,景点位于平遥古城内，需先到达古城内，再步行前往： 古城不算太大，可以步行游玩。城内有不少拉客的电瓶车，10-30元不等，有老人小孩可考虑坐车； 此外，也可以租辆自行车，在古城及周边转转，别有一番风味，费用大约10元半天,包含在平遥古城门票内,全天,山西省平遥县古城南大街,
5670984,/poi/9989.html,9989,听雨楼,5,这里晚间很好看的说，亮亮的等我，就想启明灯指引我们，好有特色啊,2013-11-26 16:17:00,听雨楼，位于山西省平遥古城老县衙外。从县衙里面可以登上去，在楼上可以俯瞰平遥全景。,114,,,半小时-1小时,步行前往，从县衙里面可以登上去,包含在平遥古城门票内,8:00-19:00,山西省晋中市平遥县政府街,
5670984,/poi/6338530.html,6338530,北门城楼,5,城墙建筑就想北京故宫，这种历史古都承载着很多以前的痕迹，喜欢这里,2013-11-26 16:18:26,这里是平遥古城的北大门，买了套票的游客可以登临城楼俯瞰平遥古城，视野非常开阔，风景很不错。,121,,,1小时,位于平遥古城内，步行前往即可,包含在平遥古城门票内,8:00-19:30,晋中市平遥县平遥古城北门城楼,
5670984,/poi/30618.html,30618,晋祠景区,3,感觉一般把，潜伏在太原，冬天去的，不是很好，人也不是很多的说,2013-11-26 16:19:16,--晋祠景区为纪念周武王次子叔虞而建，祠内有几十座古建筑，素以雄伟的建筑群、高超的塑像艺术闻名于世。 --是集中国古代祭祀建筑、园林、雕塑、壁画、碑刻艺术为一体的唯一而珍贵的历史文化遗产，难老泉、侍女像、圣母像被誉为“晋祠三绝”。 --除此之外，晋祠内还有唐太宗李世民亲自撰写并手书的《晋祠铭》碑，十分珍贵。 --春夏秋三季的晋祠可看山水和人文景观，冬天晋祠人少，略显得荒凉，但这时的历史感也最为浓厚。,2858,0351-6020014,http://www.chinajinci.com/index.html,1-2小时,晋祠景区位于太原市，距离晋源区约5公里 公交： 乘坐301路、302路、308路、804路、848路、856路至【晋祠公园】站。,旺季95元/人（ 3月1日-11月30日），淡季75元/人（12月1日- 2月28日），,8:00-18:00 （4月-10月）；8:30-17:00（11-3月）,山西省太原市晋源区晋祠镇,圣母殿
5670984,/poi/10109.html,10109,碛口古镇,5,真心喜欢这里啊，讲解的大爷说我们这里建筑都是四通八达，一方有难，八方支持,2013-11-28 15:56:57,碛口古为兵事要冲，在明清至民国年间凭黄河水运一跃成为我国北方著名商贸重镇，西接陕、甘、宁、蒙，东连太原、京、津，为东西经济、文化之枢纽，享有 “九曲黄河第一镇”之美誉。现镇内有数量丰富且保存完好的明清时期建筑，主要有货栈、票号、当铺等各类商业性建筑和庙宇、民居、码头等，几乎包括了封建制度下民间典型的漕运商贸集镇的全部类型。由于古镇至今还是原始质朴的居民生活形态，所以又有“活着的古镇”之称。,511,,,,,,,山西省吕梁市临县碛口镇,
5670984,/poi/6325817.html,6325817,避暑山庄,3,我们是十一去的，不用避暑就已经很冷了，但是感觉建筑很气派，佩服当时的人们,2013-11-28 15:58:59,承德避暑山庄位于中华人民共和国河北省承德市。曾是中国清朝皇帝的夏宫。距离北京230公里。是由皇帝宫室、皇家园林和宏伟壮观的寺庙群所组成。避暑山庄位于承德市中心区以北，武烈河西岸一带狭长的谷地上，它始建于1703年，历经清朝三代皇帝：康熙、雍正、乾隆，耗时89年建成。  山庄分四大区域，南边是宫殿区和湖区，北边是山区和平原区，其中宫殿区和湖区是避暑山庄的精华所在。 宫殿区： 避暑山庄正门（位于丽正门大街上）一进去，就能看到宫殿区，所以一般最先游览宫殿区。 因为避暑山庄是清政府与外会晤的地方，以接待外宾的礼仪来建造山庄，所以规格极高，相当于故宫的规格，同时为了在外宾面前展现中华民族传统美德谦逊、节俭的一面，宫殿区在整体布局上显得古朴、大方，但是在建筑用材上又很名贵，主殿澹泊敬诚殿全部用楠木造成，标准的“低调的奢华”，在设计上可谓“煞费苦心”。 从挂有“避暑山庄博物馆”牌匾的门进入，宫殿区的游览就开始了，依次看过挂着康熙御笔“避暑山庄”四字牌匾的阅射门、主殿澹泊敬诚殿、死过嘉庆、咸丰两任皇帝的烟波致爽殿等，大概最多2个小时能游览完宫殿区。从后门出，下一个坡，就到了去山区游览的环山车上车点。 山区： 如果时间足够，宫殿区游览完顺路坐环山车游览山区，时间有限的话，可以放弃山区直奔湖区。 山区占了避暑山庄面积的五分之四，富家大户造园林，弄几座小假山点缀多得是，真正把莽莽群山圈进来的，却闻所未闻，康熙在造避暑山庄时的深意，大概是叫后世子孙不要忘记自己的民族来自遥远的群山之外，也不要忘记群山之外虎视眈眈瞧着自己版图的外族。 一路坐环山车会经过不少景点，但是只能在车上看看，会放游客下来游览的只有“四面云山”，“二马道”，“青枫绿屿”三站。三站中比较有意思的是“二马道”，站在避暑山庄的围墙上，可以看到外八庙（为与清朝会晤的少数民族建立的宗教场所）中的普陀宗乘之庙（俗称“小布达拉宫”）和普宁寺，小布达拉宫的金顶在阳光下闪闪发光，尤为显眼。环山车到了“芳园居”那便是终点站了，芳园居就在如意湖西岸，下车后可以直接游览湖区。 湖区： 在北方之所以会有避暑山庄这样湖面上的亭台楼阁，源于康熙、乾隆两位皇帝对于江南景色的喜爱，湖区虽仿江南建筑与水相结合的特点，却又比江南的小桥流水大气得多。山庄共有“康乾72景”——康熙题字36景，乾隆题字36景。要想把72景集全其实不太可能，有些景很小，走走不注意就错过了。72景中却有31景在湖区，游览湖区相当于游览72景的“浓缩版”。其中烟雨楼是必去的，模仿嘉兴南湖的烟雨楼而建，是电视剧《还珠格格》的拍摄地之一。在湖区还可以坐一坐脚踏船，泛舟湖上，参考价50元/小时。 平原区： 位于山区和湖区之间，从湖区贴着山庄的东边往北走即到。平原区的西部是草原，以皇帝举行赛马活动的试马埭为主体；东部是林地，称万树园，园中有不同规格的28座蒙古包。平原区还有曾藏《四库全书》的皇家藏书阁文津阁，永佑寺、春好轩、宿云檐等建筑。,5397,0314-2029771;0314-2022779,http://www.bishushanzhuang.com.cn/webgroup/index.asp,4小时,避暑山庄在承德市区内，交通方便。 出租车5元起步，当地人不习惯打表，一般市区内任何一点到避暑山庄都不超过10元。  公交： 1. 1路、2路、7路、8路、11路、29路“火神庙”站下。 2. 5路、6路、6路区间、10路、15路“避暑山庄”站下。 注：距离承德火车站大约3公里，火车站出来，“火车站”公交站上的每一辆公交车（1路、2路、5路、7路、15路、29路）都能到达避暑山庄。 内部交通： 1. 环湖电瓶车50元，不建议坐，湖区周边景点集中，环湖步行，可以慢慢欣赏各个景点。 2. 游船50元，摆渡性质的船，就是把游客从湖的一边渡到另一边，意义不大，自己可以用脚走过去的。 3. 环山车50元，避暑山庄里的山区还是很大的，建议坐一下。,旺季（4月1日-10月31日）145元 淡季（11月1日-次年3月31日）90元 大于6岁小等于18岁未成年人、全日制大学本科及以下学历学生、60岁以上老人凭有效证件半票，小等于6岁或1.2米以下儿童、70岁以上老人凭有效证件免票。,旺季（4月1日-10月31日）7:00-18:00 淡季（11月1日-次年3月31日）8:00-17:30,河北省承德市双桥区碧峰门路,避暑山庄博物馆
5670984,/poi/2569.html,2569,栈桥,4,我记得去那里是我第一次自助游，而且是我的毕业旅游，意义特别。,2013-11-28 16:00:50,青岛栈桥是青岛海滨风景区的景点之一，是国务院1982年首批公布的国家级风景名胜区，也是首批4A级国家旅游区。青岛栈桥由回澜阁、中山路、小青岛、海水浴场等景点组成。全球闻名的青岛啤酒标签上，印刻着与青岛同龄的栈桥的身影。 青岛栈桥全长440米，宽8米，钢混结构。长长的线条，直伸向深海里，仿佛是到了海的中心，遂停下，化作一亭，取名回澜阁，八角型的亭子，在中国古代建筑中并不少见，只是这海中的风景，算是稀罕的吧。大雾升腾的光景，眺望海中央，那里，仿佛海市蜃楼。 若是秋天来栈桥，一定要赶在涨潮时，站在栈桥的西岸，看惊涛拍岸后激起的巨浪，轰然作响，极为壮观。退潮时，潮水一退近百米，沙滩上就会有很多拣贝壳、挖蛤蜊的游人，海鸥会在离海岸近的地方低徊盘旋，也许这就是青岛最浪漫的地方了。 桥北沿岸，辟为“栈桥公园”，园内花木扶疏，青松碧草，并设有石椅供游人憩坐，观赏海天景色；桥西侧立有华灯，入夜如株株玉兰盛开。栈桥本身还可停靠旅游船，由此乘船可看海上青岛。,3861,0532-82884548,,2小时,乘2、5、6、8、25、26、218、220、223、225、301、304、305、307、311、316、320、321、501、217、801等路公交车在栈桥公园站下车可达,门票免费，回澜阁同样免费开放，但目前仅一楼对外开放。,回澜阁旺季7:00-19:00，淡季8:00-17:30,青岛市市南区太平路12号,
5670984,/poi/3511.html,3511,南锣鼓巷,3,里头装修很可以，不过最多的还是吃的，那里吃的一是很好，二是有特色,2013-11-28 16:02:07,"南锣鼓巷是北京最古老的街区之一，位列于规划中的25片旧城保护区之中。南锣鼓巷南北走向，北起鼓楼东大街, 南止地安门东大街， 全长786米， 宽8米，与元大都(1267年)同期建成， 是我国唯一完整保存着元代胡同院落肌理、规模最大、品级最高、资源最丰富的棋盘式传统民居区。 如今这里开起了风格百变的个性店铺，精巧时尚的私房小馆，元朝古巷新旧混血，就此重生，全球游客都爱来此“迷失北京”。",5687,,,半天,到达北口：乘107、124、204、635路在宝钞胡同站下，107、124、204路在小经厂站下，或乘地铁6号线或8号线南锣鼓巷站下。 到达南口：乘13、60、118、612、623路在锣鼓巷站下，104、108、113、201、612、758路在北兵马司站下，向西经过东棉花胡同即是。,免费,全天,北京市东城区南锣鼓巷,
5670984,/poi/2572.html,2572,青岛五四广场,3,记得去的时候阴雨天气，后头都是阴云，感觉很美妙啊，后头又如海市蜃楼,2013-11-28 16:03:57,五四广场因“五四运动”而得名，是如今青岛的标志之一，与音乐广场比起来这里的游客更多一些。广场正中那形如螺旋般红火风团的雕塑名为“五月的风”，彰显了庄重、坚实、蓬勃向上的爱国情怀。 以“五月的风”为中心，向西延伸，有浪漫欧式的音乐广场，向东则绵延连向奥运会帆船赛场。相似的海畔风景，不同的景观格调，相较于汇泉湾和栈桥景区的海岸线，这里的风景更时髦，这里的青岛更现代。广场周边是这座城市地价最高的CBD，倚在海边栏杆上，回望这现代经济造就的现代风景，你会感受到青岛独特的豪迈与温情。,2555,0532-85711594,,1-2小时,乘317路公交车在五四广场站下车； 或乘25、26、31、202、304、316、318路公交车在市政府站下车南行即到,开放式区域，免费,全天,山东省青岛市市南区东海西路35号,
5670984,/poi/30618.html,30618,晋祠景区,3,去过那里，是2月份去的，哪里都是光秃秃的，不是很喜欢的说啊。,2013-11-28 16:05:22,--晋祠景区为纪念周武王次子叔虞而建，祠内有几十座古建筑，素以雄伟的建筑群、高超的塑像艺术闻名于世。 --是集中国古代祭祀建筑、园林、雕塑、壁画、碑刻艺术为一体的唯一而珍贵的历史文化遗产，难老泉、侍女像、圣母像被誉为“晋祠三绝”。 --除此之外，晋祠内还有唐太宗李世民亲自撰写并手书的《晋祠铭》碑，十分珍贵。 --春夏秋三季的晋祠可看山水和人文景观，冬天晋祠人少，略显得荒凉，但这时的历史感也最为浓厚。,2858,0351-6020014,http://www.chinajinci.com/index.html,1-2小时,晋祠景区位于太原市，距离晋源区约5公里 公交： 乘坐301路、302路、308路、804路、848路、856路至【晋祠公园】站。,旺季95元/人（ 3月1日-11月30日），淡季75元/人（12月1日- 2月28日），,8:00-18:00 （4月-10月）；8:30-17:00（11-3月）,山西省太原市晋源区晋祠镇,圣母殿
5670984,/poi/2580.html,2580,青岛崂山风景区,4,山不是很多，往上走都是雾，但是感觉很好，为泰山做准备好了把。,2013-11-28 16:06:18,崂山是中国海岸线第一高峰，有着“海上第一名山”之称。它是山东半岛的主要山脉，崂山的主峰名为“巨峰”，又称“崂顶”。  当地有一句古语说：“泰山虽云高，不如东海崂。”传说秦始皇、汉武帝都曾来此求仙，而丘长春、张三丰也都曾在此修道。山海相连，山光海色，正是崂山风景的特色。在全国的名山中，唯有崂山是在海边拔地崛起的。当你漫步在崂山的青石板小路上，一边是碧海连天，惊涛拍岸；另一边是青松怪石，郁郁葱葱，你会感到心胸开阔，气舒神爽。 崂山景区主要包括巨峰（崂顶看日出最棒）、流清、太清（崂山最著名道观所在地）、棋盘石（佛教特色）、仰口（海滨度假胜地，有觅天洞及华严寺）、北九水（山水结合的峡谷风貌，夏天雨水充沛时最美）、华楼（花岗岩叠石风貌）几个游览区。其中，流清——太清——棋盘石——仰口在同一游览线上。,2888,0532-88898866;0532-88899000,http://www.qdlaoshan.cn/,半天或一天,公交：乘104、106、107、110、113、123、304、311、312、365、371、802路等公交车崂山沙子口下车即到； 自驾：青银高速——崂山区高科园口下高速——海尔路向东行驶——可到景区，车程约30分钟,通票：160元/人； 旺季：巨峰游览区进山门票：80元/人，半价40元/人； 流清游览区—太清游览区—棋盘石游览区—仰口游览区进山门票： 90元/人，半价45元/人； 北九水游览区进山门票： 65元/人，半价32元/人； 淡季：巨峰游览区进山门票：50元/人，半价25元/人； 流清游览区—太清游览区—棋盘石游览区—仰口游览区进山门票： 60元/人，半价30元/人；北九水游览区进山门票：40元/人，半价20元/人； 华楼游览区全年票价：10元/人,旺季（4月1日至10月31日）6:00-19:00； 淡季（11月1日至次年3月31日）7:00-17:00,山东省青岛市崂山区流清河,
5670984,/poi/5429543.html,5429543,北武当山,3,四月份去的，天气不是很好，在网上查的能坐公交去的，但事实是根本不可能,2013-11-29 13:49:36,北武当山，又名真武山，古称龙王山，座落在吕梁山脉中段，山西省方山县北武当镇东北侧，这里群峰耸峙、怪石嵯峨，松奇林幽，溪水绵延，共由72峰、36岩、24涧组成，景区规划总面积80平方公里，已开发开放的景区约20平方公里。主峰香炉峰海拨2280米，比五岳之首的泰山（海拔1545米）高753米，比湖北的南武当（海拔1612米）高668米。,45,0358-6025411,,,,72元,06:00~18:00,山西省吕梁地区方山县境内,
